Kategori,Ürün Adı,Fiyat,Satıcı,Minimum Sipariş
furniture,Tüm hava alüminyum açık kesit bahçe mobilyası k...,$399-450,Foshan Goodmaker Furniture ...,Minimum sipariş: 1 Adet
furniture,Montessori çocuk yuvası mobilyası çocuklar için...,$25-40,Xiair International Trade (...,Minimum sipariş: 2 Adet
furniture,Bar mobilyaları/otel mobilyaları/restoran mobil...,$40-50,PERFECTS COLLECTION INDIA,Minimum sipariş: 10 Kutu
furniture,Antik veya Modern stil lüks mobilya ahşap yatak...,"$458,16-572,70",SPACETIME OVERSEAS PRIVATE ...,Minimum sipariş: 5 Adet
furniture,Oluşturma Marriott otel yüksek sınıf lüks hafif...,$699-899,Guangdong Creation Furnitur...,Minimum sipariş: 30 Takım
furniture,Toptan antika kahverengi klasik tasarım üç kolt...,$86-88,DOMICA FURNITURE INDUSTRIES...,Minimum sipariş: 100 Takım
furniture,Dayanıklı özelleştirilebilir sağlam ahşap mobil...,"$2,77",NEFS FURNITURE VIET NAM CO....,Minimum sipariş: 10 Adet
furniture,TRIHO S81844 muhtasar kumaş oturma odası kanepe...,$25,TRIHO COMPANY LIMITED,Minimum sipariş: 50 Kutu
furniture,Temiz ve Minimalist tasarım ile sağlam ahşap mo...,"$13,50-15",NEFS FURNITURE VIET NAM CO....,Minimum sipariş: 100 Adet
furniture,Akıllı Modern LED mobilya seti oturma odası içi...,$40-46,Dongguan E Smart Live Techn...,Minimum sipariş: 2 Adet
furniture,Bahçe Nordic Modern dış mekan mobilyaları ev se...,$20-33,Yongkang Dashing Leisure Pr...,Minimum sipariş: 2 Adet
furniture,Toptan Modern restoran mobilya setleri Cafe Fas...,"$15-90,47",Zhuhai Chenghuai Furniture ...,Minimum sipariş: 1 Adet
furniture,Yüksek kalite kral otel ahşap yatak odası mobil...,$109-149,Shenyang Meizhige Furniture...,Minimum sipariş: 2 Adet
furniture,Fabrika fiyat Çin tedarikçisi yatak set lüks ot...,$580-900,Foshan Maple Green Furnitur...,Minimum sipariş: 20 Takım
furniture,Modern sadelik tasarım mikrofiber kumaş oturma ...,$338-368,"Foshan Gaoyin Trading Co., ...",Minimum sipariş: 1 Takım
furniture,Foshan otel mobilya çift-yatak odası mobilyası ...,$459-499,EXPORTMASTER LIMITED,Minimum sipariş: 10 Takım
furniture,Lüks 5 yıldız otel yatak odası mobilyası hampto...,$190-650,Foshan Maple Green Furnitur...,Minimum sipariş: 10 Takım
furniture,Üst tahıl inek hakiki deri 3 2 1 lüks tasarım r...,$600-1.420,"Foshan Yaai Furniture Co., ...",Minimum sipariş: 2 Takım
furniture,Avrupa fransız zarif koyu avant-garde mobilya s...,$18.240,Kumsmall Factory Avm Isletm...,Minimum sipariş: 1 Takım
furniture,El yapımı bambu mobilyaları sandalye masa benze...,$30,BAO MINH MANUFACTURER JOINT...,Minimum sipariş: 10 Adet
furniture,Zhida oturma odası İtalyan tarzı ev mobilya lük...,$161-489,Guangdong Zhida Furnishings...,Minimum sipariş: 2 Adet
furniture,Çocuk mobilyası plastik çocuk oyuncak depolama ...,"$47,55-49,55",Zhejiang Vsuch Maternal And...,Minimum sipariş: 2 Takım
furniture,WBERT aydınlatıcı amerikan lüks keten Metal kri...,$200-800,Foshan Gaoyu Home Technolog...,Minimum sipariş: 1 Takım
furniture,Toptan moda tasarımı dış mekan mobilyası bahçe ...,$26-42,Yongkang Dashing Leisure Pr...,Minimum sipariş: 2 Adet
furniture,Modern yer kazandıran mobilya yatak odası fonks...,$143,Hangzhou Vittoria Furniture...,Minimum sipariş: 100 Adet
furniture,JingYue özel şeffaf lüks reçine çiçek ticari al...,$500-1.500,Huizhou Jingyue Soft Decora...,Minimum sipariş: 1 Adet
furniture,Kahve dükkanı iç tasarım kabarcık çay mağaza te...,$4.200-4.500,Shenzhen Pioneer Display Ca...,Minimum sipariş: 1 Takım
furniture,Modern yuvarlak masa dayanıklı Metal halat sand...,$76,Foshan City Longang Furnitu...,Minimum sipariş: 2 Çift
furniture,Kore modern tarzı oturma odası USB şarj aleti k...,$599-959,Shenzhen Mebon Furniture Co...,Minimum sipariş: 5 Takım
furniture,Ekintop Modern Minimalist dikdörtgen okul kütüp...,"$55-62,20",Guangdong Esun Furniture Te...,Minimum sipariş: 2 Takım
furniture,Özel lüks modern restoran mobilya altın bacak k...,$42-110,Foshan Xingmu Furniture Co....,Minimum sipariş: 10 Adet
furniture,Modern bahçe yumurta sandalye dış mekan mobilya...,$43-63,Bazhou Shuangai Furniture C...,Minimum sipariş: 2 Takım
furniture,Benzersiz bahçe mobilyaları Rattan sehpa seti i...,$200,Foshan Hanbang Furniture Co...,Minimum sipariş: 1 Takım
furniture,Cabrio açık veranda bahçe mobilyaları cabrio gö...,"$35,50-38,50",Wuyi Shengchi Leisure Produ...,Minimum sipariş: 100 Adet
furniture,En çok satan bahçe çimento mobilya ve çimento t...,"$47,90",Yixing Meiling Horticulture...,Minimum sipariş: 10 Adet
furniture,SongDesign Modern High-End mobilya 5-Star otel ...,$28-100,Guangdong Timesong Home Fur...,Minimum sipariş: 1 Takım
furniture,Modern lüks oturma odası bardak tutucu ile mobi...,$160-543,Foshan Qiantong Furniture C...,Minimum sipariş: 2 Adet
furniture,Tatil paketi ve özel Villa Modern tasarım için ...,$28-100,Guangdong Timesong Home Fur...,Minimum sipariş: 1 Takım
furniture,Fulin toptan Modern alüminyum Rattan bahçe yast...,"$112,86-128,20",Foshan Chunfeng Fulin Outdo...,Minimum sipariş: 1 Adet
furniture,Sehpalar ve TV standı takım mobilya altın çerçe...,$200-280,"Foshan Calla Furniture Co.,...",Minimum sipariş: 2 Adet
furniture,Modern Premium katı ahşap mobilya seti yüksek k...,$390,PT KARYA KREATIF AGAPE MEBE...,Minimum sipariş: 1 Yirmi Fut Konteyner
furniture,Küçük daire tasarımcı lüks mobilya kanepeler lü...,$449-465,Quanzhou Youtai Household P...,Minimum sipariş: 2 Adet
furniture,Villa daire 5 yıldızlı oteller için özelleştiri...,$1.299-1.499,"Foshan Kunyi Furniture Co.,...",Minimum sipariş: 20 Adet
furniture,Yeni tasarım ev mobilyası katı ahşap klasik yem...,$100-500,Guangzhou Sunray Import And...,Minimum sipariş: 1 Adet
furniture,Özel Modern lüks masif ağaç mobilya setleri 5 y...,$699-899,Jiangmen Eastmate Hotel Fur...,Minimum sipariş: 10 Adet
furniture,Tik Rattan yemek sandalyeleri ve masa bahçe set...,"$0,01-0,02",CV. PROFESTAMA KURNIA NISA,Minimum sipariş: 50 Takım
furniture,Modern sandalyeler restoran açık hasır yemek sa...,$160,Foshan Tenggu Furniture Co....,Minimum sipariş: 1 Adet
furniture,Özel avrupa standart ahşap plaka modüler yemek ...,$86-88,Fanmu Principle (Chongqing)...,Minimum sipariş: 2 Metre Kare
furniture,Ev mobilyaları ve güzel yatak odası mobilyası t...,$598-2.780,Foshan Haoyu Furniture Factory,Minimum sipariş: 2 Adet
furniture,Lüks lüks yemek odası mobilyası Set yuvarlak ah...,$43-75,Shanghai Youjing Import & E...,Minimum sipariş: 1 Adet
furniture,Yüksek kaliteli Modern tasarım oturma odası yer...,$289,"Wuxi Ideal Furniture Co., Ltd.",Minimum sipariş: 2 Takım
furniture,Tüm el yapımı açık balkon dokuma mobilya halat ...,$90-165,Foshan Shunhuang Furniture ...,Minimum sipariş: 1 Takım
furniture,Sıcak satış mobilya fabrika oturma odası kanepe...,$395-450,Ganzhou Linkun Furniture Co...,Minimum sipariş: 10 Akre
furniture,Toptancı Modern çin tarzı katı ahşap yüksek kal...,$168-228,Ganzhou Kemai Furniture Co....,Minimum sipariş: 2 Takım
furniture,Ahşap mermer oturma odası ev mobilya seti lüks ...,$28-31,Foshan Ulink Furniture Limited,Minimum sipariş: 10 Adet
furniture,Yeni Modern lüks restoran mobilya plaka ahşap s...,$53-159,"Jiangmen Exl Furniture Co.,...",Minimum sipariş: 2 Adet
furniture,Ev Mobilyaları Genel Kullanım ve Oturma oda dol...,"$22,21-28,06",Caoxian Cloud East Arts And...,Minimum sipariş: 50 Adet
furniture,6 kişilik küçük bahçe kesit kanepeler kanepe mo...,$125-149,Jinhua Breathable Furniture...,Minimum sipariş: 1 Adet
furniture,Modern yumurta şekli dış mekan mobilyası bahçe ...,$40-55,Guangzhou Rich Union Commer...,Minimum sipariş: 1 Adet
furniture,Veranda mobilya bahçe setleri dökme alüminyum m...,"$39,10-47,90",Guangxi Mojia E-Commerce Co...,Minimum sipariş: 100 Adet
furniture,YQ sonsuza yeni tasarım gri Modern tarzı mobily...,$70-95,Jiangsu Forever Furniture C...,Minimum sipariş: 2 Adet
furniture,Mobilya fabrika doğrudan toptan ev oturma oturm...,$280-330,Foshan Xianyi Furniture Co....,Minimum sipariş: 2 Adet
furniture,Yatak odası takımı mobilya toptan Modern lüks o...,$150-200,Foshan Perfect Furniture Co...,Minimum sipariş: 3 Takım
furniture,Fabrika kaynağı rahat kaliteli ışık lüks Minima...,"$371,43-714,29","Foshan Cxdesign Co., Ltd.",Minimum sipariş: 2 Takım
furniture,All-in-One ev mobilyaları Villa ve daire için y...,$399-1.099,"Foshan Difan Furniture Co.,...",Minimum sipariş: 10 Takım
furniture,Bar mobilyaları yağ bidonu resepsiyon masası öz...,$345-365,"Foshan Leto Furniture Co., Ltd",Minimum sipariş: 1 Adet
furniture,Modern stil 100% ahşap oturma odası mobilya ev ...,$29-99,Zhongshan Mu Ya Furniture C...,Minimum sipariş: 50 Takım
furniture,Yeni tasarım bez sanat kanepe küçük aile oturma...,$356-665,Beijing Hongshiji Home Furn...,Minimum sipariş: 2 Takım
furniture,Bütün ev özel dekoratif mobilya bütün ev mobily...,$40-41,Zhongshan Tianye Building M...,Minimum sipariş: 5 Metre Kare
furniture,High End Modern tasarım lüks kanepeler oturma o...,$369-489,Jinhua Sigma Industrial & T...,Minimum sipariş: 2 Adet
furniture,Ahşap çerçeve lüks kraliyet mobilya kanepe seti...,$265,BERFA IC VE DIS TICARET AYD...,Minimum sipariş: 35 Adet
furniture,Özelleştirilebilir ahşap mobilya yatak odası ba...,$198-238,"Anhui Aotu Furniture Co., Ltd.",Minimum sipariş: 10 Metre Kare
furniture,Modern özelleştirilmiş suyu dondurma hızlı Bar ...,$800-1.200,Shenzhen Carpenter Family F...,Minimum sipariş: 2 Takım
furniture,Özelleştirilmiş ticari mobilya lüks Bar sayacı ...,$5.000-7.800,Savy Furnishing(Shenzhen) C...,Minimum sipariş: 2 Takım
furniture,Dış mekan mobilyası alüminyum metal ve kumaş ve...,$143-400,Foshan Sanshui Hangkai Furn...,Minimum sipariş: 1 Adet
furniture,Foshan açık restoran teras mobilya PE Rattan 5 ...,$55-99,Foshan Shunde Ciao Furnitur...,Minimum sipariş: 20 Adet
furniture,Yatak masası dizüstü bilgisayar masası Charmoun...,"$1,50-2,80",Ningbo Charm-Tech Import An...,Minimum sipariş: 1.000 Adet
furniture,Meuble De chachabir Coucher Complet 2023 Modern...,$350-420,Foshan Cappellini Furniture...,Minimum sipariş: 2 Takım
furniture,Ihracat için İtalya'da yapılan oturma odası kom...,"$4.532,90-5.518,31",VF Home Decor SRLS,Minimum sipariş: 2 Birim
furniture,Lüks bahçe setleri mobilya açık PE Rattan kanep...,"$99,99-158,88",Foshan Kingwell Industry Co...,Minimum sipariş: 5 Takım
furniture,Çocuk mobilyası setleri bebek yatak odası anaok...,$86-88,Kule Suplayer (wenzhou) Tra...,Minimum sipariş: 1 Takım
furniture,Şık Modern ekran oturma odası yatak odası özel ...,$110-120,Dalian Jinqiao Wood Industr...,Minimum sipariş: 2 Düzine
furniture,Köy teras su geçirmez yastık rahat halat mobily...,$178-223,Foshan Momoda Furniture Co....,Minimum sipariş: 1 Adet
furniture,Sıcak satış PE Rattan ahşap tahıl bahçe veranda...,$62-339,Foshan Sungreen Furniture C...,Minimum sipariş: 2 Adet
furniture,En iyi 5 parça restoran yemek seti mobilya açık...,$39-150,"Foshan Audia Furniture Co.,...",Minimum sipariş: 2 Adet
furniture,Tüm hava katı ahşap cabrio veranda Chaise Teak ...,$98-200,HUY GIA HARDWARE TRADE SERV...,Minimum sipariş: 10 Takım
furniture,Gainsville mobilya Modern Foshan Frato mobilya ...,$455-900,Gainsville Home Furnishings...,Minimum sipariş: 1 Adet
furniture,Ayna dolap yatak odası mobilyası organizatör il...,$150-500,Foshan Isyfia Furniture Co....,Minimum sipariş: 2 Metre
furniture,Modern yeni tasarım özelleştirilmiş boyutu mobi...,$298,CBMmart International Limited,Minimum sipariş: 3 Metre
furniture,Retro endüstriyel restoran kahve mobilya ahşap ...,$120-122,Guangzhou Gold Apple Furnit...,Minimum sipariş: 20 Takım
furniture,En çok satan bahçe çimento mobilya ve çimento t...,"$19,20",Yixing Meiling Horticulture...,Minimum sipariş: 15 Adet
furniture,Doğrudan fabrika satış Modern eğlence doğal mer...,$45-65,"Yunfu Telazuo Stone Co., Ltd.",Minimum sipariş: 1 Adet
furniture,Ticari fabrika fiyat Modern tasarım lüks otel r...,"$25,80-63,50",Tianjin God-Source Furnitur...,Minimum sipariş: 50 Adet
furniture,SongDesign Modern tasarım tarzı 5 yıldızlı otel...,$28-100,Guangdong Timesong Home Fur...,Minimum sipariş: 1 Takım
furniture,2024 otel mobilya otel Villa projesi yatak odas...,$289-399,Foshan Rong He Tai Furnitur...,Minimum sipariş: 20 Takım
furniture,Yüksek kalite Mini ahşap mobilya takım içerir k...,$120,S.R. HANDICRAFT,Minimum sipariş: 10 Adet
furniture,Modern lüks oturma odası mobilya seti yeni çin ...,"$150-400,20",Minqing County Meixi Town K...,Minimum sipariş: 2 Adet
furniture,Sıcak satış dış mekan mobilyası bahçe 3 kişilik...,$155-225,Linhai Jiefeng Crafts& Arts...,Minimum sipariş: 1 Takım
furniture,Modern otel Villa dışında aşınmaya dayanıklı al...,$123-864,Foshan Huayuxi Furniture Co...,Minimum sipariş: 2 Takım
furniture,Modern lüks oturma odası ev dekorasyon için mob...,"$30,50",Shenzhen Siji Mud Bean Tech...,Minimum sipariş: 2 Adet
furniture,Yeni ev mobilya Metal yatak odası mobilyası seh...,$89-109,Foshan Shunde New Good Furn...,Minimum sipariş: 2 Adet
furniture,Fulilai otel odası mobilyası takım 5 yıldız yat...,$599-799,Fulilai Hotel Furniture Co....,Minimum sipariş: 50 Takım
furniture,Ahşap mobilya ev mobilyası Modern mobilya 18mm ...,$95-145,"Bazhou Hetai Furniture Co.,...",Minimum sipariş: 30 Adet
furniture,Otel yatak odası mobilyası ucuz otel mobilya ku...,$220-1.200,"ZheJiang Sunzoom Co., Ltd.",Minimum sipariş: 20 Takım
furniture,İskandinav basit tarzı kumaş ev mobilya seti yü...,$200-1.500,"OrDecor Furniture Co., Ltd.",Minimum sipariş: 1 Adet
furniture,Çin'de mobilya satın ev mobilyaları katı ahşap ...,$558-638,Guangzhou Wenjiasheng Netwo...,Minimum sipariş: 1 Takım
furniture,2 çekmeceli lüks suni deri yatak odası depolama...,$53,"Youngs Handcrafts Co., Ltd.",Minimum sipariş: 50 Takım
furniture,Mobilya fabrikası tüm yüksek kalite mobilya set...,$80-200,"Beijing Santa Sun Co., Ltd.",Minimum sipariş: 2 Adet
furniture,High End tik ahşap kapı veranda otel mobilya ar...,"$219,90-489,90",Foshan Kingmake Industry Co...,Minimum sipariş: 2 Takım
furniture,Paslanmaz çelik dayanıklı high-end mobilya özel...,$96-108,Chongqing Aiyueju Furniture...,Minimum sipariş: 4 Takım
furniture,Yeşil kadife kanepe kabinleri sandalyeler oturm...,$113,Foshan Nianyi Home Furnishi...,Minimum sipariş: 5 Adet
furniture,Son tasarım ahşap mobilya üstün kalite kahveren...,$250-280,LUXURY HOME COLLECTION,Minimum sipariş: 12 Adet
furniture,Çocuk odası mobilya ahşap oyuncaklar kitaplar r...,$25-35,Xuzhou Henghui Furniture Co...,Minimum sipariş: 2 Adet
furniture,Lüks avrupa tarzı ahşap mobilya Set büyük kumaş...,$1.225-2.608,Dongguan He Xin Furniture C...,Minimum sipariş: 1 Adet
furniture,Sıcak satış lüks oturma odası mobilya seti yumu...,$1,PT RELIFA ART FURNITURE,Minimum sipariş: 10 Birim
furniture,Çocuk odası mobilya ahşap oyuncaklar kitaplar r...,$39-219,"Ningbo Royal Union Co., Ltd.",Minimum sipariş: 20 Adet
furniture,NOVA akıllı mobilya Modern basit çok fonksiyonl...,$50-120,Shenzhen iStapromo Gifts Co...,Minimum sipariş: 2 Adet
furniture,Oturma odasında ve yatak odasında kahve masası ...,$280-650,"Jinhua Sage Furniture Co., ...",Minimum sipariş: 2 Adet
furniture,Klasik tarzı rustik bitirmek Modern mobilya gel...,$90-120,INDIA BUYING INC.,Minimum sipariş: 10 Adet
furniture,DST ev mobilya yeni lüks oturma odası setleri t...,$400-3.000,D.S.T. EXPORTS,Minimum sipariş: 1 Takım
furniture,Toffy & Friends ahşap çocuk sanat şövale blackb...,$15-25,Fujian Senda Foreign Trade ...,Minimum sipariş: 100 Adet
furniture,Yeni çin tarzı oturma odası mobilya kanepe komb...,$135-501,Zhongshan Shanmu Furniture ...,Minimum sipariş: 2 Adet
furniture,Mobilya tarzı mobilya oturma odası sağlam ahşap...,$285,Shenzhen Redde Boo Furnitur...,Minimum sipariş: 10 Takım
furniture,Ev mobilya seti. Yüksek kaliteli ahşap. Lüks. M...,$200-300,VIET NAM SOURCE JOINT STOCK...,Minimum sipariş: 20 Takım
furniture,Eğlence için en çok satan dış mekan mobilyası h...,"$23,55-26,95",Yuyao Believe Leisure Produ...,Minimum sipariş: 100 Adet
furniture,Yemek odası mobilyası,$55-60,"SAM YI INTERNATIONAL CO., LTD.",Minimum sipariş: 200 Takım
furniture,"Tüm ahşap mobilya, tüm ev için özelleştirilmiş,...",$988-1.688,"OE HOME CO., LIMITED",Minimum sipariş: 20 Takım
furniture,Lüks ev mobilyası altın yan sehpa/sehpa,$40-69,Liancheng Xinrui Oumao Elec...,Minimum sipariş: 2 Adet
furniture,Sıcak satış restoran mobilya sandalye sehpa yem...,"$19,80-168","Foshan Yuehe Trading Co., Ltd.",Minimum sipariş: 2 Adet
furniture,KD bahçe seti mobilya ferforje bahçe masa ve sa...,"$41,50-42,50",Jiangxi Hometec Outdoor Pro...,Minimum sipariş: 660 Takım
furniture,Ahşap mobilya,$125-130,TAIWAN MIRROR GLASS ENTERPR...,Minimum sipariş: 200 Adet
furniture,Tüm hava açık tik ağacı mobilya bahçe seti kane...,$256-299,Champion (Shenzhen) Import ...,Minimum sipariş: 5 Adet
furniture,Ev mobilya üreticisi ihracatçıları ve dünya çap...,$400-3.000,D.S.T. EXPORTS,Minimum sipariş: 1 Takım
furniture,Modern masif ahşap mobilya tik açık koltuk takı...,$330,Shangrao Qimeng Lis Trading...,Minimum sipariş: 1 Adet
furniture,Uzun hizmet ömrü ile iyi son fiyat özelleştirme...,"$21,12-21,99","BEAR ASIA FURNITURE CO., LTD.",Minimum sipariş: 100 Kutu
furniture,Guangdong fabrika restoran mobilya kadife kanep...,$26-107,Foshan Kaizda Furniture Co....,Minimum sipariş: 2 Adet
furniture,Wooden Furniture Living Room Set with Metal Cof...,$25-55,MOON STAR EXPORTS,Minimum sipariş: 100 Adet
furniture,Endonezya mobilyaları ev mobilya asılı CD rafla...,$1-2,CV DWIRA JEPARA,Minimum sipariş: 2 Adet
furniture,Modern stil ahşap mobilya Set ticari restoran o...,"$45,71",Guangzhou Mingmeng Furnitur...,Minimum sipariş: 2 Adet
furniture,Basit tasarım ahşap malzeme iç mekan mobilyası ...,$126-136,Guangzhou Sunrise Oriental ...,Minimum sipariş: 20 Takım
furniture,El işi el yapımı lüks katı klasik görünüm ahşap...,$17-20,HASAN CRAFT,Minimum sipariş: 100 Adet
furniture,Çin mobilya fabrikası Modern tuvalet beyaz küçü...,$21-25,FORTUNEWELL (XIAMEN) GLOBAL...,Minimum sipariş: 100 Takım
furniture,Daire mobilya metal çerçeve katlanabilir kanepe...,"$84,89-99",Xuzhou Maxfine Home Furnish...,Minimum sipariş: 2 Adet
furniture,Ev dekor için TV arka plan ve kanepe arka plan ...,"$46,60-49,30",Hefei Qingyuan Home Furnish...,Minimum sipariş: 10 Metre Kare
furniture,Yüksek kaliteli kolay monte için ahşap mobilya ...,$280,AN VIET FURNITURE ONE MEMBE...,Minimum sipariş: 50 Adet
furniture,Daire çözüm basit mobilya tam Set mobilya öğele...,$55-120,Shandong Jining Sandia Wood...,Minimum sipariş: 5 Metre
furniture,JINSHAN yeni varış oturma odası ahşap mobilya s...,$118-385,Ganzhou Jinshan Furniture C...,Minimum sipariş: 2 Takım
furniture,Lüks avrupa ve amerikan tarzı mobilya özelleşti...,$90-100,Henan Wanfeng Decoration En...,Minimum sipariş: 5 Adet
furniture,Işık lüks kumaş kanepe kombinasyonu fransız otu...,$468-2.200,Guangdong Chuangheng Furnit...,Minimum sipariş: 20 Adet
furniture,Çağdaş daire mobilya kombinasyonu Set yatak kan...,"$69,35-76,95",Ganzhou Hebai Wood Products...,Minimum sipariş: 10 Takım
furniture,Toptan Modern lüks otel açık bahçe yuvarlak has...,$193-200,Tianjin K&j International T...,Minimum sipariş: 50 Takım
furniture,Mobilya setleri Modern lüks modüler Minimalist ...,$2.300-2.500,SHENZHEN FORESTAR INDUSTRY ...,Minimum sipariş: 5 Takım
furniture,Modern masif ahşap mobilya yüksek kalite basit ...,$120-129,"Shenzhen Ida Furniture Co.,...",Minimum sipariş: 20 Adet
furniture,Lüks Modern ticari otel salonu kanepe sandalye ...,$905-985,"Foshan Paken Furniture Co.,...",Minimum sipariş: 30 Takım
furniture,Yüksek kalite 2024 son tasarım yüzer mobilya se...,$92-110,Bazhou City Shengfang Town ...,Minimum sipariş: 2 Takım
furniture,Lüks oturma odası mobilya yemek odası mobilyası...,$799-899,Zhejiang Six Sences Furnitu...,Minimum sipariş: 2 Takım
furniture,Modern oturma odası mobilya seti dayanıklı pasl...,$439-582,Shenzhen Cheerman Home Buil...,Minimum sipariş: 2 Takım
furniture,Popüler moda ev mobilyası Modern ve Minimalist ...,"$469,90","Dongguan Best Trade Co., Ltd.",Minimum sipariş: 100 Adet
furniture,Ücretsiz tasarım okulöncesi dış mekan mobilyası...,$45-65,Dalian West Shore Internati...,Minimum sipariş: 2 Adet
furniture,Yüksek kaliteli Naturel katı ahşap yapılmış mob...,"$17,50-42,75",RISING INTERNATIONAL,Minimum sipariş: 15 Adet
furniture,Prima güzel ev mobilya iyi tasarım yatak ve yem...,$30-50,Shenzhen Zhongbaode Industr...,Minimum sipariş: 2 Metre
furniture,Yeni otel mobilya restoran mobilya restoran kan...,$48-88,Tianjin God-Source Furnitur...,Minimum sipariş: 10 Adet
furniture,PA 2023 son tasarım akıllı oturma odası ev mobi...,"$169,66-185,17",Guangdong Baishan Furniture...,Minimum sipariş: 2 Metre
furniture,Doğal çin kül ahşap kaplama mobilya oturma odas...,$15,Hangzhou Greenland Imp&exp ...,Minimum sipariş: 2 Yaprak
furniture,Çay masası TV dolabı mobilya oturma odası mobil...,$393,Foshan Pinjia Craftsman Fur...,Minimum sipariş: 2 Adet
furniture,Yeni tasarım bahçe yuvarlak bacak kanepe ve san...,$200-2.000,Jinhua Origin Furniture Co....,Minimum sipariş: 1 Adet
furniture,Modern lüks ev mobilyası zarif kumaş kesit kolt...,$380-420,Shangquan Furniture (anji) ...,Minimum sipariş: 50 Adet
furniture,Ahşap yatak odası mobilyası için rustik stil ye...,$350,SONG KON TRADE MANUFACTURIN...,Minimum sipariş: 10 Takım
furniture,Amerikan katı ahşap ve deri mobilya diğer ahşap...,$280,"Ganzhou Elande Trading Co.,...",Minimum sipariş: 150 Takım
furniture,Gölgelik yastık dayanıklı 3 koltuk mobilya açık...,"$32,60-39,30",Shanghai Worth Internationa...,Minimum sipariş: 5 Takım
furniture,Açık Bahçe Rattan Mobilya Tüm hava PE Hasır Ver...,$100-150,Ningbo Danlong Leisure Prod...,Minimum sipariş: 50 Adet
furniture,Mükemmel tedarikçiler masa ve sandalye setleri/...,$32-35,Jiangsu Cartmay Industrial ...,Minimum sipariş: 200 Adet
furniture,Özelleştirilmiş ahşap yüksek kaliteli Modern mo...,$179-199,Ganzhou Ruitong Import Expo...,Minimum sipariş: 2 Adet
furniture,Sıcak satış uzay tasarrufu oturma odası mobilya...,$7-139,Changsha Saihu Electronic T...,Minimum sipariş: 10 Adet
furniture,Mobilya fabrika doğrudan toptan ev oturma oturm...,$309,"Foshan Shiyi Furniture Co.,...",Minimum sipariş: 5 Adet
furniture,Tüm mobilya High-End Modern tasarım şık evler i...,$888-1.888,Foshan Define Furnishing Co...,Minimum sipariş: 2 Takım
furniture,"Yeni çin tarzı katı ahşap kanepe, yatak, dolap,...",$900,"Hebei Dongtian Trade Co., Ltd.",Minimum sipariş: 2 Takım
home-garden,Özelleştirilmiş salıncak Boom Mini ekskavatör ü...,$1.600,Shandong Leite Machinery Co...,Minimum sipariş: 1 Adet
home-garden,Lüks Modern 3x5 elektrikli biyoiklim Pergola al...,$140-180,Guangdong Rustic House Fiit...,Minimum sipariş: 10 Metre Kare
home-garden,Sebze ve çiçek yetiştirmek için bahçe kutusu Su...,$30,Qingdao Hongwei Dongtai Tra...,Minimum sipariş: 500 Paket
home-garden,"Arka bahçedeki en popüler bahçe çardağı, 4*4 me...",$48-58,Chongqing Yulanshi Technolo...,Minimum sipariş: 1 Metre Kare
home-garden,Yapay gül çiçekler toplu gerçekçi sahte ipek gü...,"$0,89-1,20",Shengyuan Dakang (beijing) ...,Minimum sipariş: 100 Adet
home-garden,Çatı yüksek bahçe çiçekliği avlu gölgelik kiti ...,$54,Qingdao Vitavia Garden Prod...,Minimum sipariş: 200 Adet
home-garden,HF 34in boyalı demir rüzgar çan tüp Metal ev de...,"$3,95","Guangzhou Hefu Crafts Co., ...",Minimum sipariş: 24 Adet
home-garden,Alüminyum yapı kış bahçe kış bahçesi sunroomlar...,$60-220,Foshan Tianpuan Building Ma...,Minimum sipariş: 2 Metre Kare
home-garden,Ev bahçe küçük sera yüksek kaliteli güneş odası...,"$227,30-238,60",Changzhou Growell Garden Pr...,Minimum sipariş: 50 Adet
home-garden,Üretim 10x10 13x10 13x13 20x13 Ft alüminyum Per...,$180-190,"R & C Fuzhou Houseware Co.,...",Minimum sipariş: 9 Metre Kare
home-garden,Vegetable Raised Garden Bed Outdoor Landscaping...,"$2,70-2,85",Taian Huge Metal Products C...,Minimum sipariş: 500 Adet
home-garden,Döken aracı ile bahçe çok fonksiyonlu aracı ev ...,$136-142,Henan Steelart Science And ...,Minimum sipariş: 100 Adet
home-garden,Açık yaşam için sürgülü cam zarif Pavilion ile ...,$110-160,Suzhou Minhong Building Mat...,Minimum sipariş: 1 Metre Kare
home-garden,Çin lüks alüminyum prefabrik yeşil ev-kapsül av...,$25.300-25.400,Foshan Gaochenkuaiyu Techno...,Minimum sipariş: 1 Birim
home-garden,Yapay bitkiler şimşir Topiary topları UV koruma...,$19-24,Guangzhou Zhijing Arts & Cr...,Minimum sipariş: 48 Paket
home-garden,Modern tasarım kapalı/açık ahşap çiçek standı s...,"$19,99-24",Linyi Linger Arts and Craft...,Minimum sipariş: 100 Adet
home-garden,Modern Minimalist yeşil kapalı/açık bitki dekor...,$42-57,Zhangzhou High-Tech Zone Ji...,Minimum sipariş: 10 Adet
home-garden,Modern su geçirmez açık bahçe gizlilik duvar pa...,"$2,17",Anhui Aolo New Materials Te...,Minimum sipariş: 200 Metre
home-garden,Ucuz 40ft lüks bina cep minik modüler prefabrik...,$50-60,Suzhou Daxiang Container Ho...,Minimum sipariş: 1 Metre Kare
home-garden,3 5 7 10 20 galon kolu 145gsm sert olmayan doku...,"$0,45-0,85",Guangdong Enon New Material...,Minimum sipariş: 10 Adet
