Kategori,Ürün Adı,Fiyat,Satıcı,Minimum Sipariş
electronics,Korean moda dijital IGBT invertör AC/DC PULSE a...,$500-641,"Andeli Group Co., Ltd.",Minimum sipariş: 1 Takım
electronics,Ziso9001 ISO9001 petrol gazı buhar akış kontrol...,$100-3.000,Shanghai Juliang Valve Grou...,Minimum sipariş: 1 Adet
electronics,3C gadget elektronik ürün şanslı hediye oyuncak...,"$3,80",Quanzhou Tucson Technology ...,Minimum sipariş: 3 Adet
electronics,SDSQXAV-256G-GN6MN tüketici elektroniği ürünü,"$17,40",JIMPOWER TRADING LIMITED,Minimum sipariş: 1 Adet
electronics,Sürpriz elektronik rastgele seçilmiş yenilik oy...,"$4,90-9,60",Shenzhen If Then Technology...,Minimum sipariş: 1 Adet
electronics,İyi yorumlar gizem kutusu sürpriz kablosuz kula...,"$4,90",Shenzhen Yueqian Mofang Tra...,Minimum sipariş: 1 Poşet
electronics,New00ma güç banka istasyonu tüketici elektroniğ...,"$3,99-10,88",Dongguan Sheng Chuangda Tec...,Minimum sipariş: 1 Adet
electronics,3C Gadget elektronik gizem kutusu şanslı hediye...,"$4,90",Shenzhen Julan Electronics ...,Minimum sipariş: 1 Adet
electronics,Elektronik şanslı gizem kutusu 2025 elektronik ...,"$4,90",Shenzhen Juneng Vehicle Tec...,Minimum sipariş: 1 Adet
electronics,Şanslı gizem elektronik su geçirmez Smartwatch ...,"$15,80",Shenzhen Hualuo E-Commerce ...,Minimum sipariş: 1 Kutu
electronics,Iyi değerlendirmeleri sürpriz akıllı saatler ka...,"$4,50-9,80",Yulin Yuzhou District Ms Ch...,Minimum sipariş: 1 Adet
electronics,3D yüz tanıma Tuya WIFI APP anahtarsız giriş pa...,"$39,17-44,17","Td Hardware Co., Ltd.",Minimum sipariş: 100 Takım
electronics,100% yeni elektronik ürün şanslı gizem kutusu y...,$32,Zeri Industrial Shenzhen Co...,Minimum sipariş: 1 Kutu
electronics,Enerji tasarrufu 3 Fan hız kontrol termostatı F...,$13-20,Xiamen Hedeman Electronics ...,Minimum sipariş: 3 Adet
electronics,Gizem kutusu elektronik trend ürünleri 2025 yen...,"$3,80-5,80",Shenzhen Cyber Blue Electro...,Minimum sipariş: 1 Adet
electronics,NeweKey akıllı kilit yatak odası kapısı elektri...,$48-59,Guangdong LFF Technology Co...,Minimum sipariş: 2 Takım
electronics,Sürpriz elektronik gizem kutusu yüksek değer bü...,"$4-5,90",Blue Whale Preferred (shenz...,Minimum sipariş: 1 Adet
electronics,Kaynak elektrotları/çubuklar yapma makinesi/çel...,$60.000-250.000,Shijiazhuang Shuanglu Machi...,Minimum sipariş: 1 Takım
electronics,Ürünleri ile toptan gizem sürpriz kutu elektron...,"$4,90-9,80",Shenzhenshi Jingyingtong Tr...,Minimum sipariş: 1 Adet
electronics,Toptan dijital Mini taşınabilir bagaj ölçeği se...,"$5,25-5,35",Shenzhen Quan & Heng Weighi...,Minimum sipariş: 1.000 Adet
electronics,Elektronik 3C gizem kör kutu noel hediyesi kare...,"$4,90-9,80",Shenzhen Cyber Blue Electro...,Minimum sipariş: 1 Adet
electronics,"Ev kullanımı için komple 3000w, 4000w, 5000w gü...","$0,35-0,60","Sunway Solar Co., Ltd.",Minimum sipariş: 10.000 Watt
electronics,2025 yaz yeni bültenleri serin yenilikçi tüketi...,$26-40,Xiamen Paltier Electronic T...,Minimum sipariş: 1 Adet
electronics,Magnetic Wireless Power Bank 10000mAh Portable ...,$5-50,Yangjiang Xinzhuo Electroni...,Minimum sipariş: 20 Adet
electronics,Toptan Yison yeni sürüm modeli A23 yüksek kalit...,"$8,14-8,49",Guangzhou Yison Electron Te...,Minimum sipariş: 20 Adet
electronics,BLANTH enstrüman piyano dijital piyano taşınabi...,"$65,50-69",Quanzhou Bolanshi Electroni...,Minimum sipariş: 2 Takım
electronics,Yüksek değer 3C elektronik ürünler şanslı gizem...,"$9,90",Shenzhen Kaiyifan Technolog...,Minimum sipariş: 1 Adet
electronics,23.8 Inch 10-Point Touch All-In-One Educational...,$2.200-2.300,Hebei Haijie Modern Educati...,Minimum sipariş: 1 Birim
electronics,2024 3c elektronik ürünler şanslı gizem hediye ...,"$16,80-19,80",Shenzhen Chaowu Technology ...,Minimum sipariş: 1 Kutu
electronics,OEM ve ODM taşınabilir Mini akıllı ev hava temi...,"$48,90",Lu'an Hengnuowei Technology...,Minimum sipariş: 5 Adet
electronics,100% olsun elektronik ürünler gizem kutusu gadg...,"$29,90",Chengdu Fibe Technology Ser...,Minimum sipariş: 1 Birim
electronics,Elektrik talebi tüketimini azaltmak için en iyi...,$800-8.000,Anhui Zhongdian Electric Co...,Minimum sipariş: 1 Takım
electronics,Akıllı elektronik Online yeni ve orijinal çeşit...,"$0,01",Shenzhen Smart Electronics ...,Minimum sipariş: 1 Adet
electronics,Süper ince 10000mAh güç banka LCD ekran hızlı ş...,"$2,89-3,89",Guangzhou Upl Digital Techn...,Minimum sipariş: 100 Adet
electronics,Mart EXPO hediye kutusu tüketici elektroniği sü...,"$4,99-9,99",Shenzhen Shengye Technology...,Minimum sipariş: 1 Adet
electronics,0.5KG elektronik gizem kutusu 100% sürpriz şans...,"$3,80",Shenghai Future (shenzhen) ...,Minimum sipariş: 1 Adet
electronics,Kullanılan PS5 ince elektronik ürün,$300-332,Guangzhou Yilian Electronic...,Minimum sipariş: 1 Adet
electronics,In-Ear kablolu kulaklık USB mikrofonlu kulaklık...,"$0,45",Shenzhen Cnbado Electronics...,Minimum sipariş: 1.000 Adet
electronics,2024 3c elektronik ürünler şanslı gizem hediye ...,"$5,30-9,90",Yijia (shaanxi) Technology ...,Minimum sipariş: 1 Adet
electronics,Gizemli kutular uluslararası sürpriz elektronik...,"$4,80-9,80",Shenzhen Weier Tante Techno...,Minimum sipariş: 1 Paket
electronics,2025 yeni gizem kutusu elektronik festivali şan...,"$6,90-9,90",Shenzhen Shennuo Times Tech...,Minimum sipariş: 1 Adet
electronics,Sıcak satış son akıllı saatler popüler kulakiçi...,"$5,69-7,59",Shenzhen Hengqi Trading Co....,Minimum sipariş: 1 Adet
electronics,Ücretsiz örnek gönderi trend tüketici elektroni...,"$4,65",Shenzhen Yoke Electronics C...,Minimum sipariş: 5 Birim
electronics,2024 noel hediyesi mevcut yüksek kalite Smartwa...,"$2,98-6,98",Shenzhen Yalanle Electronic...,Minimum sipariş: 1 Adet
electronics,2025 yeni yüksek değer 3C elektronik şanslı giz...,"$7,88-8,88",Shenzhen Kairui Technology ...,Minimum sipariş: 1 Adet
electronics,Büyük Roc benzersiz özellikleri temizleyici kit...,"$2,40-3,55",Shenzhen Great Roc Technolo...,Minimum sipariş: 2 Adet
electronics,Diyot dirençler kapasitörler ile 1200 adet kaps...,"$9,80-16",Shenzhen Sinapus Technology...,Minimum sipariş: 1 Kutu
electronics,Basma Düğmesi Elektronik Ses ses Müzik Müzik ve...,"$0,30-1,90",Shenzhen ESYS Electronics C...,Minimum sipariş: 1.000 Adet
electronics,Sıcak satış son akıllı saatler popüler kulakiçi...,"$5,69-7,59",Shenzhen Hengqi Trading Co....,Minimum sipariş: 1 Adet
electronics,Ücretsiz örnek gönderi trend tüketici elektroni...,"$4,65",Shenzhen Yoke Electronics C...,Minimum sipariş: 5 Birim
electronics,2024 noel hediyesi mevcut yüksek kalite Smartwa...,"$2,98-6,98",Shenzhen Yalanle Electronic...,Minimum sipariş: 1 Adet
electronics,2025 yeni yüksek değer 3C elektronik şanslı giz...,"$7,88-8,88",Shenzhen Kairui Technology ...,Minimum sipariş: 1 Adet
electronics,Büyük Roc benzersiz özellikleri temizleyici kit...,"$2,40-3,55",Shenzhen Great Roc Technolo...,Minimum sipariş: 2 Adet
electronics,Akıllı elektronik orijinal yeni elektronik bile...,"$0,12-5",Shenzhen Smart Electronics ...,Minimum sipariş: 10 Adet
electronics,100% sürpriz yenilik elektronik rastgele fare a...,"$4,90-9,60",Shenzhen Cyber Blue Electro...,Minimum sipariş: 1 Kutu
electronics,3c elektronik ürünler şanslı gizem hediye oyunc...,"$4,80-9,80",Shenzhen Weier Tante Techno...,Minimum sipariş: 1 Paket
electronics,Diyot dirençler kapasitörler ile 1200 adet kaps...,"$9,80-16",Shenzhen Sinapus Technology...,Minimum sipariş: 1 Kutu
electronics,Basma Düğmesi Elektronik Ses ses Müzik Müzik ve...,"$0,30-1,90",Shenzhen ESYS Electronics C...,Minimum sipariş: 1.000 Adet
electronics,BOE NV156FHM-N69 1920*1080 IPS TFT LCD bilgisay...,$85,Shenzhen Texianliang Techno...,Minimum sipariş: 1 Adet
electronics,Müzik kartı kayıt cihazı/basma düğmesi ses modü...,"$1,50",Shenzhen ESYS Electronics C...,Minimum sipariş: 1.000 Adet
electronics,"Gizem kutusu elektronik ücretsiz kargo, Tws kul...","$19,80",Shenzhen Chaowu Technology ...,Minimum sipariş: 1 Kutu
electronics,Pratik gizem kutusu elektronik festivali şanslı...,"$6,90-9,90",Shenzhen Shennuo Times Tech...,Minimum sipariş: 1 Adet
electronics,"Gizem kutusu elektronik ürünler, Tws kulaklık H...","$7,70-9,90",Shenzhen Bassworld Technolo...,Minimum sipariş: 1 Adet
electronics,Yeni 2025 değerli gizem kutusu elektronik festi...,"$6,90-9,90",Shenzhen Shennuo Times Tech...,Minimum sipariş: 1 Adet
electronics,3C elektronik ürün şanslı gizem hediye kutusu e...,"$7,70-9,90",Shenzhen Bassworld Technolo...,Minimum sipariş: 1 Adet
electronics,Yeni varış 7 in 1 bilgisayar telefonu elektroni...,"$2,50-3,20",Shenzhen Hengxingyuan Techn...,Minimum sipariş: 2 Adet
electronics,Çift USB taşınabilir tüketici elektroniği lityu...,"$3,07",Shenzhen Golf & Feihuang Te...,Minimum sipariş: 500 Adet
electronics,Şanslı gizem kör kutu 5G elektronik 3C ürünleri...,"$7-9,80",Blue Whale Preferred (shenz...,Minimum sipariş: 1 Adet
electronics,Profesyonel üretim ucuz yüksek kalite 1000w ele...,"$23,50-27,50",Yongkang XXM Industry And T...,Minimum sipariş: 1 Adet
electronics,AilesTecca elektronik şanslı gizem kutusu elekt...,"$8,80",Shenzhen Ailestecca Technol...,Minimum sipariş: 1 Adet
electronics,En satıcı elektronik TG808 kablosuz hoparlörler...,"$7,30",Shenzhen Keruisheng Environ...,Minimum sipariş: 5 Adet
electronics,Kullanılan PS5 ince elektronik ürün,$190-210,Guangzhou Yilian Electronic...,Minimum sipariş: 1 Adet
electronics,Kırmızı piyano okuma öğrenme çocuklar için elek...,"$3,57-3,86",Shenzhen YDL Technology Co....,Minimum sipariş: 1.000 Adet
electronics,Elektronik gizem kutusu rastgele şanslı aksesua...,"$49,60",Shen Zhen Shi Lingable Tech...,Minimum sipariş: 1 Adet
electronics,El elektronik uyku yardım cihazı sinir sakinleş...,$8,Shenzhen YDL Technology Co....,Minimum sipariş: 1 Adet
electronics,Kırmızı PCB avrupa versiyonu kırmızı kurulu ile...,"$43,39",Shenzhen Chunbell Electroni...,Minimum sipariş: 1 Adet
electronics,Elektronik evrensel parçalar elektronik bileşen...,"$3,30-5,50",Shenzhen Yuzens Technologie...,Minimum sipariş: 2 Adet
electronics,MysteryBox elektronik 2025 yeni festivali yenil...,"$3,50",Shenghai Future (shenzhen) ...,Minimum sipariş: 1 Adet
electronics,Öğeleri ile sürpriz elektronik gizemli kör kutu...,"$4,90-9,80",Shenzhenshi Jingyingtong Tr...,Minimum sipariş: 1 Adet
electronics,AilesTecca iyi değerlendirmeleri sürpriz akıllı...,"$5-8,80",Shenzhen Ailestecca Technol...,Minimum sipariş: 1 Adet
electronics,7 in 1 elektronik temizleyici kiti bilgisayar k...,"$2,10-2,28",Guangzhou Zhenshang Electro...,Minimum sipariş: 50 Adet
electronics,Şanslı elektronik Vintage festivali TK gizem ku...,"$6,88-9,88",Shenzhen Kairui Technology ...,Minimum sipariş: 1 Adet
electronics,Ucuz fiyat kablolu katlanabilir çocuklar kulakl...,"$10,90",Shenzhen Compoka Electronic...,Minimum sipariş: 108 Adet
electronics,Ev elektronik tamir için taşınabilir şarj edile...,"$9,46",Tangshan Lianghua Metal Tec...,Minimum sipariş: 10 Adet
electronics,2025 sürpriz şanslı elektronik akıllı saatler k...,"$9,32",Pinghe County Jiayu Future ...,Minimum sipariş: 1 Poşet
electronics,Electronics Basic Kit Power Supply Module+Bread...,"$4,20-6,20",Shenzhen TCT Electronics Co...,Minimum sipariş: 50 Adet
electronics,Stokta elektronik bileşenler Ic elektronik SN74...,"$0,99",Shenzhen Yuetaijia Electron...,Minimum sipariş: 1 Adet
electronics,Tüketici elektroniği için STARPOWER ayrık güç y...,$20-30,Qingdao Senyao Precision Te...,Minimum sipariş: 10 Birim
electronics,Plastik konut elektronik ve enstrüman muhafazal...,"$1,20-1,60",Shenzhen Xingda Precision M...,Minimum sipariş: 1 Adet
electronics,Çok fonksiyonlu Retro kayıt bavul Turntable gra...,$21-25,Huizhou Dosound Electronics...,Minimum sipariş: 500 Takım
electronics,3C elektronik rastgele sürpriz kablosuz kulaklı...,$33,Shaanxi Silk Road Cloud Pat...,Minimum sipariş: 1 Adet
electronics,Sıcak satış ürünleri 2024 araçlar elektronik el...,"$6,85-16,50",Shenzhen Friendever Technol...,Minimum sipariş: 1 Adet
electronics,Şanslı elektronik gizem kutusu cep telefonu gad...,"$4,90",Shenzhen City Longhua Distr...,Minimum sipariş: 1 Poşet
electronics,Şanslı elektronik Retro yeni T akıllı dijital a...,"$4,90",Shenzhen City Longhua Distr...,Minimum sipariş: 1 Poşet
electronics,Shenzhen elektronik üreticisi yüksek kalite ile...,"$0,99",Shenzhen Shangfeng Electron...,Minimum sipariş: 1 Adet
electronics,2025 SmartSTEELWatch sürpriz satış makinesi şan...,$7-11,Shenzhen Amio Cross-Border ...,Minimum sipariş: 10 Adet
electronics,2025 trend elektronik gizem kutusu 5G Smartphon...,"$29,95-59,60",Shenzhen If Then Technology...,Minimum sipariş: 1 Adet
electronics,MysteryBox elektronik 59 TK modeli özel durum s...,"$4,90",Shenzhen Julan Electronics ...,Minimum sipariş: 1 Kutu
electronics,2025 yeni rastgele 3C elektronik Lectronique OL...,"$18,80",Shenzhen Hualuo E-Commerce ...,Minimum sipariş: 1 Adet
electronics,Günlük ev kullanımı için 2024-2025 yenilikçi tü...,$35,Xiamen Paltier Electronic T...,Minimum sipariş: 1 Adet
electronics,2025 iyi değerlendirmeleri sürpriz hediye yenil...,"$4,90",Shenzhen Yueqian Mofang Tra...,Minimum sipariş: 1 Poşet
electronics,Şanslı elektronik gizem kutusu 2025-dizüstü bil...,"$4,60-9,50",Shenzhen Cyber Blue Electro...,Minimum sipariş: 2 Kutu
electronics,100% sürpriz değerlendirmeleri şanslı oyun kont...,"$4,50-9,60",Shenzhen Cyber Blue Electro...,Minimum sipariş: 1 Adet
electronics,Dizüstü bilgisayarlar dahil 2025 sıcak satış gi...,"$17,50-19,80",Shenzhen Chaowu Technology ...,Minimum sipariş: 1 Kutu
electronics,Büyük değer gizem kutusu elektronik festivali ş...,"$6,90-9,90",Shenzhen Shennuo Times Tech...,Minimum sipariş: 1 Adet
electronics,Iyi değerlendirmeleri sürpriz akıllı saatler ka...,"$4,90-9,70",Shenzhen Juneng Vehicle Tec...,Minimum sipariş: 1 Kutu
electronics,Shenzhen festivali hediye akıllı saatler satmak...,$25-39,Shenzhen Juneng Vehicle Tec...,Minimum sipariş: 1 Kutu
electronics,Akıllı telefon sürpriz akıllı saatler kablosuz ...,"$4,80-9,80",Shenzhen Weier Tante Techno...,Minimum sipariş: 1 Paket
electronics,Akıllı elektronik s-mart. COM Online satın yeni...,"$0,01-0,10",Shenzhen Smart Electronics ...,Minimum sipariş: 1 Adet
electronics,Akıllı elektronik yeni ve orijinal elektronik b...,"$0,05-0,10",Shenzhen Smart Electronics ...,Minimum sipariş: 100 Adet
electronics,2025 sürpriz şanslı elektronik gizem kutusu akı...,"$7-8,80",Blue Whale Preferred (shenz...,Minimum sipariş: 1 Adet
electronics,Elektronik gizem kutusu akıllı telefon kulaklık...,"$4,30-4,90",Blue Whale Preferred (shenz...,Minimum sipariş: 1 Adet
electronics,Şanslı Smartphone elektronik Vintage gizem kutu...,"$14,80-19,80",Shenzhen Weier Tante Techno...,Minimum sipariş: 1 Paket
electronics,Su geçirmez IP65 çelik elektrik dağıtım kontrol...,$19-25,"Yueqing Box Electric Co., Ltd.",Minimum sipariş: 5 Adet
electronics,Yüksek kalite akıllı saat rastgele sürpriz an e...,"$4,90",Shenzhen City Longhua Distr...,Minimum sipariş: 1 Poşet
electronics,Shenzhen elektronik üreticisi düşük fiyat ile e...,"$0,50",Shenzhen Shangfeng Electron...,Minimum sipariş: 1 Adet
electronics,Diyot dirençler kapasitörler ile 1200 adet kaps...,"$4,80-16,88",Shenzhen I-Circuit Electron...,Minimum sipariş: 1 Kutu
electronics,Shenzhen elektronik üreticisi elektronik bileşe...,"$0,50",Shenzhen Shangfeng Electron...,Minimum sipariş: 1 Adet
electronics,Müzik elektronik modülü ile LED ışık parlaklık ...,$1,Xinmitu Industry(shenzhen)c...,Minimum sipariş: 100 Adet
electronics,Tüm boyut çok ucuz ekran 7 10.1 12.1 13.3 15.6 ...,$190,Shenzhen Kaiyan Electronic ...,Minimum sipariş: 2 Adet
electronics,Kaya 2025 elektronik sıcak satış EB900 kulakiçi...,$8,Shenzhen Rock Space Technol...,Minimum sipariş: 40 Adet
electronics,USB3.2 İki-in-one veri 100W şarj hattı tip-c ta...,"$4,50-5,46",Suzhou Kaimeyue Electronic ...,Minimum sipariş: 1 Adet
electronics,2025 fabrika kablosuz BT kulaklık elektronik de...,"$5,80",Shenzhen Binshidu Technolog...,Minimum sipariş: 100 Adet
electronics,Üreticinin elektrikli makine eğitim ekipmanları...,$21-25,Shenzhen Lanke Technology C...,Minimum sipariş: 5 Adet
electronics,Tüketici elektroniği için 16000mAh pil Fan klim...,"$14,76",Jiangsu Nengdun Clothing Co...,Minimum sipariş: 1 Adet
electronics,Birden fazla tüketici elektroniği cihazı için M...,$35-45,"Mix Tech Co., Ltd.",Minimum sipariş: 1 Poşet
electronics,Güç elektroniği ve Motor kontrol teknolojisi iç...,$8.400-11.000,Xuchang Zhongyi Electrical ...,Minimum sipariş: 1 Adet
electronics,Elektronik panoları için OEM tedarikçisi özelle...,$10-30,Shenzhen Hongjin Weiye Tech...,Minimum sipariş: 1 Adet
electronics,Elektronik ekipman T2 tipi elektrik malzemeleri...,"$9,20-15,60",Guangdong Reske Electric Te...,Minimum sipariş: 1 Adet
electronics,2072-2P LED SMD terminalleri lehimsiz yüksek sı...,"$0,16",Shenzhen Mingyun Electronic...,Minimum sipariş: 700 Kutu
electronics,DIN ray etkisi sinyal dönüştürücü akım çıkışı D...,"$28,40",Shenzhen United Innovation ...,Minimum sipariş: 5 Adet
electronics,Fabrika doğrudan tedarik makul fiyat elektronik...,"$6,78-6,99",Shenzhen Bestway Technology...,Minimum sipariş: 500 Adet
electronics,Çeşitler dahil 1900 adet Mega elektronik bileşe...,"$8,99-9,99",Shenzhen Youxinbang Technol...,Minimum sipariş: 1 Takım
electronics,OEM ve ODM taşınabilir Mini akıllı ev hava temi...,"$48,90",Lu'an Hengnuowei Technology...,Minimum sipariş: 5 Adet
electronics,Istikrarlı sıcaklık lehim makinesi robotu için ...,$3.088,Dongguan Kexinghua Technolo...,Minimum sipariş: 1 Adet
electronics,Devre kartı tertibatı temel malzeme ile hava ar...,$10,Suzhou Yu Xin Chang Electro...,Minimum sipariş: 1.000 Adet
electronics,Sıcak satış OEM fabrika 55W 5000mAh pil LCD ekr...,"$14,50-17,50",Dongguan Runhe Technology C...,Minimum sipariş: 100 Adet
electronics,Akıllı telefonlar için tüketici elektroniği ter...,$20,Dongguan Jiadi New Material...,Minimum sipariş: 1 Kilogram
electronics,Çok fonksiyonlu dijital Retro Jukebox renkli RG...,$550,Huizhou City Wanxing Electr...,Minimum sipariş: 1 Adet
electronics,Source Factory Fifth Generation Wireless Earpho...,$6,Changsha Mumuyun Electronic...,Minimum sipariş: 20 Adet
electronics,Beyzbol ve futbol oyunları için uzaktan elektro...,$200,Xiamen Xingtuo Import And E...,Minimum sipariş: 1 Karton
electronics,110V/220V elektrikli 100mm açı öğütücü 1250W PV...,"$9,85",YUZHOU CHENGUANG ABRASIVE T...,Minimum sipariş: 2 Adet
electronics,16V500F otomotiv Ultracapacitor modülü büyük ak...,$121-124,Huizhou Jiyixin Technology ...,Minimum sipariş: 10 Adet
electronics,ms serisi 12v 1a anahtarlamalı güç kaynağı,$1-10,"Andeli Group Co., Ltd.",Minimum sipariş: 10 Adet
electronics,Taşınabilir 180W açık taşınabilir şarj cihazı k...,"$68,88-79,88",Guangzhou Haishun Network T...,Minimum sipariş: 1 Takım
electronics,Z50 1080p projektör sıcak satış 4K 650 lümen LC...,$130-138,Dongguan Xinyu Cheng Electr...,Minimum sipariş: 1 Adet
electronics,Yüksek malzeme 5.08mm Plug-in PCB Terminal bloğ...,"$0,04",Cixi Kefeng Electronic Tech...,Minimum sipariş: 100 Adet
electronics,Elite 5000mAh kablosuz Qi hızlı şarj için 15W i...,"$2,80-3,50",Shenzhen Qiao Communication...,Minimum sipariş: 3.000 Birim
electronics,Sıcak satış özel Logo 5000mah 10000mah Ultra hı...,$3-4,Yangjiang Xinzhuo Electroni...,Minimum sipariş: 20 Adet
electronics,WENXIN taşınabilir santral 50HZ 60HZ 2KW/2.5KW/...,"$68,40-375,52",Zhejiang Wenxin Import & Ex...,Minimum sipariş: 50 Takım
electronics,Yüksek kapasiteli 10000mAh Ultra ince Mini güç ...,"$4,12",Shenzhen Yusheng Technology...,Minimum sipariş: 10 Adet
electronics,Sıcak satış ABS su geçirmez IP55 koruma seviyes...,"$0,34-0,40","Wenzhou Enrui Electric Co.,...",Minimum sipariş: 6 Adet
electronics,CE SC-1000T ile optik otomotiv ve Nano uygulama...,"$5.999,99-7.199,99",Shenzhen Xianhua Technology...,Minimum sipariş: 1 Takım
electronics,NTC termistör 10D-9 NTC10D9 9mm çap negatif sıc...,"$0,04-0,05",Shenzhen Yixingshun Electro...,Minimum sipariş: 500 Adet
electronics,Yüksek yoğunluklu MIL-DTL-83513 yılında J30J-21...,"$19-21,70",Xi'an Samsor Electronic Tec...,Minimum sipariş: 1 Adet
electronics,Professional High-Power Resistor Manufacturer C...,$20,Jiangxi Sichuang Electric C...,Minimum sipariş: 1 Adet
electronics,Akıllı WiFi soket fiş beyaz HongJun akıllı ev,$9,Sichuan Hongjun Science And...,Minimum sipariş: 10 Kutu
electronics,Süper 100F çift katmanlı kapasitör otomotiv ele...,$30-45,Huizhou Jiyixin Technology ...,Minimum sipariş: 10 Adet
electronics,One-Stop elektronik bileşenler kaynak ve montaj...,"$0,60-0,80",Shanghai Rongzhen Electroni...,Minimum sipariş: 1 Adet
electronics,Orijinal yeni SMT Fuji 2SGKBA001600 NL05G güç k...,$320-350,Shenzhen Extension Electrom...,Minimum sipariş: 1 Akre
electronics,Hızlı şarj teknolojisine sahip gelişmiş akıllı ...,$56-82,Foshan Car Charger Guardian...,Minimum sipariş: 2 Adet
electronics,Fabrika doğrudan satış M7 erkek dişi konektörle...,"$4,32-5,71",Shenzhen Jiexinbao Electron...,Minimum sipariş: 10 Adet
electronics,Ucuz fiyat yüz tanıma biyometrik akıllı kilit p...,$29-37,"Yiwu Zhuofeng Trading Co., ...",Minimum sipariş: 1 Adet
electronics,En iyi elektrikli sonic diş fırçası şarj edileb...,"$0,15-0,50","ONES INDUSTRY CO.,LTD",Minimum sipariş: 200 Adet
electronics,3 in 1 çinko alaşımlı sıvı silikon hızlı şarj c...,"$0,56-0,70","Chinabase Co., Ltd.",Minimum sipariş: 1 Adet
electronics,SUS304 su geçirmez açık elektronik kutu koruyuc...,$1.205,Hangzhou Jingyan Technology...,Minimum sipariş: 100 Birim
electronics,Açık ev enerji kullanımı için MPPT 2000 denetle...,$540-580,Shenzhen Saiwei New Energy ...,Minimum sipariş: 1 Adet
electronics,Açık kamp mobil güneş enerjisi bankası harici a...,"$5,54-6,19",Shenzhen Istyle Technology ...,Minimum sipariş: 10 Adet
electronics,IP67 su geçirmez mikro anahtarı desteklenen çeş...,"$0,30-0,40",Zhejiang Yibao Technology C...,Minimum sipariş: 1.000 Adet
electronics,"USB voltaj boost kablosu 5V 9V 12V güç bankası,...","$0,45",Shantou City Chaonan Distri...,Minimum sipariş: 100 Adet
electronics,"Colourful Light Design on the Bottom, Side USB ...","$27,80",Shenzhen Jue Micro Technolo...,Minimum sipariş: 45 Birim
electronics,APC Schneider ups kesintisiz güç kaynağı SPM1K ...,$202-215,Beijing Reston Technology C...,Minimum sipariş: 1 Birim
electronics,Güvenlik açık ana kapı parmak izi kolu Cerradur...,"$9,90-110",Zhongshan Puliduo Hardware ...,Minimum sipariş: 5 Adet
electronics,Ücretsiz özelleştirilmiş güç banka 10000 MAh dö...,"$5-5,40",Guangxi Digital Cloud Techn...,Minimum sipariş: 1 Adet
electronics,Öksürük kabartma için sessiz çalışma taşınabili...,"$15,61-21,36",Jiangshan Yuanzhou(beijing)...,Minimum sipariş: 1 Adet
electronics,Fabrika toptan telefon oyuncakları PCB devre PC...,"$0,38-0,58",Shantou City Dina Electroni...,Minimum sipariş: 5.000 Adet
electronics,G5 Gateway akıllı kilit 2.4G/5G Dual-Band kablo...,$15-19,Dongguan Qishengda Technolo...,Minimum sipariş: 2 Takım
electronics,En iyi fiyat cep telefonu arkadaşı dört çekirde...,"$4,20-4,50",Dongguan SML Electronic Tec...,Minimum sipariş: 500 Adet
electronics,OEM toptan LED TWS oyuncular için kulakiçi hızl...,"$2,85-2,98","Shantou Xinyu Industry Co.,...",Minimum sipariş: 500 Adet
electronics,Hinew yeni elektronik ürünler akıllı masa saati...,"$12,50-13,90",Shenzhen Hi-FiD Electronics...,Minimum sipariş: 1 Adet
electronics,1A + 1C güç şeridi telefon şarj kablosu güç çık...,"$4-4,20",Ningbo Pheiyon Electronic T...,Minimum sipariş: 1.000 Adet
electronics,Yüksek kaliteli tüketici elektroniği kulaklık m...,"$0,68-0,72",Shenzhen Guomi Electronic C...,Minimum sipariş: 50 Adet
electronics,Poling Android 32 43 55 inç hepsi bir dokunmati...,$420-480,Shenzhen Poling Intelligent...,Minimum sipariş: 2 Takım
electronics,Akıllı 24 inç 32 inç dokunmatik hücre içi ekran...,$440-460,Shenzhen Electron Technolog...,Minimum sipariş: 2 Adet
electronics,2024 trend elektronik ürün kemik iletim hoparlö...,"$17,90",Shenzhen Sayin Smart Techno...,Minimum sipariş: 1 Adet
electronics,"LCD ekran monitör, HD kapasitif dokunmatik moni...",$555,Guangzhou Touchwo Electroni...,Minimum sipariş: 1 Adet
electronics,Sunsuntek sohbet GPT ses akıllı elektronik dil ...,$33,Sunyee Intelligent Technolo...,Minimum sipariş: 2 Adet
electronics,Sıcak satış 32 inç hücre içi dokunmatik IPS Cas...,"$432,99-443,35",Shenzhen Electron Technolog...,Minimum sipariş: 1 Adet
electronics,Toptan sıcak satış MP1 taşınabilir güç istasyon...,"$53,99-56,99",Beijing Phoenix Town Techno...,Minimum sipariş: 1 Adet
electronics,Trend ürünleri 2024 yeni gelenler elektronik ka...,$17,Shenzhen Guangchen Internat...,Minimum sipariş: 2 Adet
electronics,Yeni araçlar 2023 akıllı ürünler elektronik ürü...,$61-84,Carer Medical Equipment Co....,Minimum sipariş: 2 Adet
electronics,Trend ürünleri 2023 yeni gelenler cep telefonu ...,"$8,99-11,99",Shenzhen Iris Technology Co...,Minimum sipariş: 1.000 Adet
electronics,Elektronik ekipman için kompakt ve taşınabilir ...,"$6,90-11,70",Guangdong Reske Electric Te...,Minimum sipariş: 1 Adet
