Kategori,Ürün Adı,Fiyat,Satıcı,Minimum Sipariş
beauty,Yüksek kalite 4-in-1 profesyonel Oval pedikür S...,"$0,80",Ningbo Kafete Daily Necessi...,Minimum sipariş: 20 Adet
beauty,Özel Logo Q İpuçları 200 adet doğal bambu pamuk...,"$0,35-0,42","Yiwu Hejun Commodity Co., Ltd.",Minimum sipariş: 500 Kutu
beauty,Vücut ve özel parçalar için sünger ile erkek 10...,"$2,69-2,99",Yunnan Land Port Internatio...,Minimum sipariş: 100 Adet
beauty,Qianjin kadife yapışmaz fincan ağız kırmızı (4 ...,"$1,66-1,99",Guangzhou Labrens Biotechno...,Minimum sipariş: 500 Adet
beauty,Üreticileri sıcak satış s-şekilli Metal güzelli...,"$0,48-0,59",Dongguan Fung Hing Hardware...,Minimum sipariş: 100 Adet
beauty,Cica Centella Soothing ca PDRN yatıştırıcı saki...,"$8,05-15,36",Purelica,Minimum sipariş: 1 Adet
beauty,Boş biyobozunur kozmetik ambalaj seti ile özel ...,"$0,08-0,22",Guangdong Idealpak Plastics...,Minimum sipariş: 10.000 Adet
beauty,Özel OEM derin yağ kontrolü akne çıkarma temizl...,"$1,50-1,80",Guangdong Jingyan Biotechno...,Minimum sipariş: 20 Adet
beauty,Patlamalar kadın parfüm uzun ömürlü koku,"$5-5,50",Beijing Jinjimei Culture Me...,Minimum sipariş: 2 Adet
beauty,Damlalık şişe cilt bakımı kozmetik damlalık pla...,"$0,50",Guangzhou JXPACK Technology...,Minimum sipariş: 5.000 Takım
beauty,Trend ürünleri 2025 özelleştirilmiş buz jel bon...,"$0,23-0,50",Ningbo Haishu Kada Industry...,Minimum sipariş: 1.000 Adet
beauty,Vücut zayıflama cihazı için vücut şekillendiric...,$2.199-3.199,Beijing Sea Heart Internati...,Minimum sipariş: 1 Adet
beauty,Lüks özel-şekillendirilmiş alüminyum Metal etik...,"$0,20-0,35",Dongguan Dongsen Lable Prod...,Minimum sipariş: 100 Adet
beauty,Özel makyaj fırçası logo Mini dudak fırçası sen...,"$0,99",Cangzhou Moyu Cosmetic Appl...,Minimum sipariş: 2 Adet
beauty,En iyi 2024 ev kullanımı güzellik ekipmanları p...,"$99,90","Sunglor Technology Co., Ltd.",Minimum sipariş: 1 Takım
beauty,2025 hidrolize kollajen hidrojen yüz maskesi hi...,"$5,50-8,50",Shenzhen Huayu Education Te...,Minimum sipariş: 10 Adet
beauty,Kadınlar için lüks vücut spreyi parfüm uzun ömü...,"$2,68",Beijing Peach Culture And C...,Minimum sipariş: 2 Adet
beauty,Su geçirmez özelliği ile pembe kozmetik posta g...,"$0,50-0,80",Xiamen Xinzixin Import And ...,Minimum sipariş: 1.000 Adet
beauty,36-Piece özel tam cilt anti-alerji akne yama ko...,"$0,20",Shenzhen Chuangshixin Adhes...,Minimum sipariş: 1 Adet
beauty,Kore hacim maskara su geçirmez leke geçirmez cl...,"$1,80-2",SMALL ENTERPRISE AND MARKET...,Minimum sipariş: 1 Adet
beauty,Hidro su soyma cilt analizörü 15 IN 1 estetik i...,$1.744-1.993,Beijing Perfectlaser Techno...,Minimum sipariş: 1 Takım
beauty,PP akrilik PS buzlu krem ambalaj olarak 30ml 50...,"$0,26-0,48",Shenzhen Zhongye Import And...,Minimum sipariş: 200 Adet
beauty,Exosome tonlama C Serum parlatıcı C vitamini Se...,$4-6,SMALL ENTERPRISE AND MARKET...,Minimum sipariş: 1 Adet
beauty,Maden suyu plastik şişe sızdırmazlık makineleri...,$9.800-9.900,Ruian Huadong Packing Machi...,Minimum sipariş: 1 Takım
beauty,Morandi taşınabilir sekiz parça Macaron makyaj ...,"$0,50-0,65",Henan Zunmei Brush Industy ...,Minimum sipariş: 2 Adet
beauty,Sıcak satış güzellik gezegen yumuşak saç kozmet...,"$1,67-1,69",Dongguan Weixiu Cosmetic To...,Minimum sipariş: 1 Adet
beauty,Erkekler ve kadınlar için en çok satan 100ml ca...,"$0,88-0,95",Ningbo Qitu Daily Necessiti...,Minimum sipariş: 10.000 Takım
beauty,Sıcak satış taşınabilir tam vücut buhar Sauna g...,"$47,99",Foshan Fumei Health Industr...,Minimum sipariş: 1 Adet
beauty,Özel posta ambalaj kağıt hediye kutuları güçlü ...,"$0,40-0,85",Jiaxing Ruida Culture And A...,Minimum sipariş: 100 Adet
beauty,Toptan 7ml özel logo boş sevimli benzersiz siya...,"$0,49-0,60","Taizhou Shinywell Tech Co.,...",Minimum sipariş: 2.000 Adet
beauty,Kişisel bakım uçucu yağ sıvı Serum şişesi 15 20...,"$0,18-0,36",Jiangyin Eu-Beauty Group Co...,Minimum sipariş: 10.000 Adet
beauty,METICA otomatik kozmetik kaş dolum makinesi sıv...,$21.000,Metica Machinery (Shanghai)...,Minimum sipariş: 1 Takım
beauty,Elizabeth Authentic otantik beşinci Avenue orya...,"$10,50",Dragon Heir International T...,Minimum sipariş: 500 Adet
beauty,Fabrika toptan kadın arabası bavul setleri ODM ...,$9-35,Dongguan Dingtian Luggage P...,Minimum sipariş: 250 Takım
beauty,Özel logo 20ml 30ml 60ml 100ml yuvarlak boş lük...,"$0,35-0,50",Shenzhen Aopai Metal Produc...,Minimum sipariş: 10 Birim
beauty,Yüksek kalite moda sıcak sıcak satış düzensiz d...,"$23,23-31,23",Jinhua Fafichen Smart Home ...,Minimum sipariş: 2 Adet
beauty,Anti-Aging cilt parlatıcı yüz yıkama beyazlatma...,"$1,09-1,61",Guangzhou Blissenu Cosmetic...,Minimum sipariş: 64 Adet
beauty,Pazen takı ambalaj torbalar şık düğün Favor hed...,"$0,40","Yiwu Linluan Trade Co., Ltd.",Minimum sipariş: 100 Adet
beauty,Doğal ahşap vücut bakımı banyo fırçası moda sti...,"$1,18",Ningbo Kafete Daily Necessi...,Minimum sipariş: 5 Adet
beauty,Kadınlar için moda yüksek kalite küçük temizle ...,"$1,24-1,32","Yiwu Bloom Textile Co., Ltd.",Minimum sipariş: 10 Adet
beauty,Yeni Lingge yedi parça seyahat depolama su geçi...,"$2,60-2,70","Yiwu Haike Luggage Co., Ltd.",Minimum sipariş: 200 Poşet
beauty,2024 yüksek kalite lüks ruj boş kozmetik kalem ...,"$0,16-0,20",Guangdong Pinfanpai Plastic...,Minimum sipariş: 10.000 Adet
beauty,Yüksek kalite 8 renkler LED yüz maskesi Home 85...,$14-18,Shenzhen Donglaimei Technol...,Minimum sipariş: 100 Adet
beauty,Zhitong özel yüksek kesme paslanmaz çelik karış...,$2.500-2.800,Yangzhou Zhitong Machinery ...,Minimum sipariş: 1 Takım
beauty,Kilo kaybı kırışıklık kaldırma Anti-Aging için ...,$500-700,Yinghehui Technology (guang...,Minimum sipariş: 1 Adet
beauty,Kozmetik beş parçalı Set cam şişeler için su em...,"$0,60-0,65",Guangzhou Haosheng Packagin...,Minimum sipariş: 101 Adet
beauty,Güzellik ürünleri özelleştirilmiş aydınlık kore...,"$0,38-0,42",Zhuhai Youth Beauty Cosmeti...,Minimum sipariş: 1.000 Adet
beauty,Yüzyıl güzellik kadın yüksek bel popo kaldırıcı...,"$14,70",Shantou Century Beauty Dres...,Minimum sipariş: 3.000 Adet
beauty,Toptan 5 1 elektrikli yüz temizleme fırçası yüz...,"$1,10-1,31","Hangzhou Yige CBEC Co., Ltd.",Minimum sipariş: 60 Adet
beauty,New Style Pink Hair Removal Razor Ladies Razor ...,"$1,69-2,35",Amsafe Sunshine Industries ...,Minimum sipariş: 5 Adet
beauty,10ml alüminyum kapaklı cam şişe kullanımı kişis...,"$0,14",Yuyao Yapoly Plastic Indust...,Minimum sipariş: 500 Adet
beauty,Saç çıkarıcı taşınabilir USB Lady elektrikli tı...,"$8,26-8,68",Foshan Clipclean Intelligen...,Minimum sipariş: 4 Adet
beauty,Taşınabilir 9ml temizle küçük yuvarlak cam uçuc...,"$0,62",Guangzhou Ninety-Nine Daily...,Minimum sipariş: 150 Adet
beauty,Büyük boy sıcak ve soğuk jel boncuk göz maskesi...,"$0,45-0,48",Laizhou Health Ice Pack Co....,Minimum sipariş: 3.000 Adet
beauty,Kozmetik ve güzellik ürünleri depolama ve ekran...,"$0,80-1,20",Wenzhou Hengkai Pakaging Co...,Minimum sipariş: 500 Adet
beauty,Toptan 250ml çekici vücut sıçrama-öpücük gizli ...,"$1,49-1,99",Beijing Jinjimei Culture Me...,Minimum sipariş: 2 Adet
beauty,Profesyonel dereceli diyot lazer epilasyon maki...,$2.800-3.500,Jinan Shengshi Spectrum Mac...,Minimum sipariş: 1 Takım
beauty,Karşılamak (12 adet) yarı kalıcı kapalı islatın...,"$3,81-4,51",Yiwu Shuangrui Electronic T...,Minimum sipariş: 3 Adet
beauty,Toptan özel takı kozmetik torbası su geçirmez h...,"$0,32-0,38","FS Dynertek (Suzhou) Co., Ltd.",Minimum sipariş: 50 Adet
beauty,Lüks tasarım şık makyaj Dresser antika yatak od...,"$46,54-50,67",Ganzhou Xinyihao Furniture ...,Minimum sipariş: 1 Takım
beauty,En çok satan TikTok foton LED ışık terapisi yüz...,$25,Shenzhen Lengmeiren Medical...,Minimum sipariş: 1 Adet
beauty,Hyaluronik asit ve C vitamini nemlendirici levh...,"$0,06-0,08",Guangdong Jingyan Biotechno...,Minimum sipariş: 50 Adet
beauty,Çift kullanımlı Mini makyaj yumurta sünger isla...,"$0,05-0,20",Yangjiang Maysmart industry...,Minimum sipariş: 2 Adet
beauty,Kendine ait marka Argan yağı saç bakımı setleri...,"$1,50-1,70",Guangzhou Xinkewang Beauty ...,Minimum sipariş: 72 Adet
beauty,Sıcak satış yüz vücut tıraş yüz saç pürüzsüz so...,"$1,43",Yiwu Fangyilan Cosmetics Co...,Minimum sipariş: 100 Adet
beauty,Sıcak satış High-End beyaz yapay tırnaklar saf ...,"$8,50","Jieyang Yizhe Trading Co., ...",Minimum sipariş: 1 Paket
beauty,Şeffaf cam boncuklar yumuşak renkli Lens kozmet...,"$2,60-3,20",Xi'an Chongtong Optical Tec...,Minimum sipariş: 10 Çift
beauty,CHIAPI yüz güzellik masajı aleti cilt sıkılaştı...,"$5,88-6,99",Beijing Chipai Medical Tech...,Minimum sipariş: 10 Adet
beauty,Soğutma yüz masajı doğal yeşim göz maskesi gül ...,"$12,50-18,50",Dongyang Haoya Art&crafts.c...,Minimum sipariş: 100 Adet
beauty,8 adet/12 adet/18 adet Beaty manikür seti yüz/a...,"$0,90-2,40",Yangjiang Songguo Network T...,Minimum sipariş: 5 Takım
beauty,Kalp atışı pembe 12 parça makyaj aracı seti fır...,"$4,59-5,56",Henan Promising Brush Indus...,Minimum sipariş: 8 Takım
sports,Spor lateks direnç bantları güç egzersiz streç ...,"$0,68",Qingdao Faba Industry And T...,Minimum sipariş: 50 Adet
sports,288 renk stokları 80% naylon 20% Spandex interl...,$4,Guangzhou Yangda Knitting C...,Minimum sipariş: 1 Metre
sports,Özel Logo saf siyah boyutu 6/7 eğitim basketbol...,"$2,85-3,28",Xiamen Chyros Sports Goods ...,Minimum sipariş: 100 Birim
sports,Toptan Logo özel Shaker su şişesi çalkalayıcı ş...,"$0,48-0,88","Ningbo Wisdom Office Co., Ltd.",Minimum sipariş: 2 Adet
sports,Su geçirmez kinesiyoloji bandı CE etiketli atle...,"$1,30",Nanjing Jiangren Textile Pr...,Minimum sipariş: 2.000 Rulo
sports,Joychuang sıkıştırma Tee ab boyutu Polyester öz...,"$2,02-2,82","Yiwu Joychuang Garment Co.,...",Minimum sipariş: 2 Adet
sports,Patentli ürün su şişeleri egzersiz yalıtımlı se...,"$3,40-4,30",Zhejiang Kuangdi Industry &...,Minimum sipariş: 500 Adet
sports,"Yaz erkek spor giyim, kısa kollu T-shirt ve şor...",$10,Jiangxi Baiying Sports Tech...,Minimum sipariş: 2 Adet
sports,Activewear & Sportswear için Premium 50D 4 yönl...,"$0,85-0,95",Suzhou Kunhui Textile Tech....,Minimum sipariş: 1.000 Metre
sports,Özel el ayarlanabilir Metal bahar egzersiz 5-60...,"$0,84",Ningbo Yiduo Sports Technol...,Minimum sipariş: 2 Adet
sports,Ticari çelik Fitness ekipmanları 8 İstasyon çok...,$2.507-2.735,Shandong Future Strength Fi...,Minimum sipariş: 1 Adet
sports,Ticari spor salonu ekipmanı koşu kemeri koşu yü...,$5-10,Shunnai Belting (shanghai) ...,Minimum sipariş: 100 Metre Kare
sports,Yüksek kalite japon PVC spor salonu yer döşemes...,"$32,25-35,50",Towa Company Ltd.,Minimum sipariş: 10 Metre
sports,Yüksek kalite toptan yumuşak ince çabuk kuruyan...,"$1,40-1,50",Zhengzhou Lanpoo Clothing C...,Minimum sipariş: 2 Düzine
sports,Sıcak satış 5M renkli 10cm kinesiyoloji bandı s...,"$0,56",Shanghai Xunhao Business Co...,Minimum sipariş: 10 Adet
sports,Rahat Anti kayma ve kayma Futbol spor özel Calc...,"$0,35-0,60",Zhuji Xingyi Knitting Factory,Minimum sipariş: 100 Çift
sports,Dayanıklı çevre dostu mantar Yoga Mat ter geçir...,"$0,06-1,40",Xi'an Xinhua Cui Technology...,Minimum sipariş: 30 Takım
sports,Profesyonel futbol eğitimi topu maç eğlence açı...,"$3,71-4,35",Guangzhou Changqiao Electro...,Minimum sipariş: 60 Adet
sports,Children's Indoor Playground Equipment With Pla...,$70-100,Wenzhou Feirui Amusement Eq...,Minimum sipariş: 50 Metre Kare
sports,Fabrika ucuz Kg ve Lb özelleştirilmiş rekabet s...,"$2,30-2,60","Xintai Aoxiang Fitness Co.,...",Minimum sipariş: 500 Kilogram
sports,Toptan özel mikrofiber kaymaz araba klozet kapa...,"$2,25-3,80",Suzhou Free Soul Outdoor Pr...,Minimum sipariş: 200 Adet
sports,"Yüksek kaliteli, şık ve yeni öğrenci spor futbo...","$2,38-3,98","Zhoukou Chende Trading Co.,...",Minimum sipariş: 2 Parsel
sports,Özelleştirilebilir yeşil alt çok ince tekne çor...,"$0,40-0,48",Shenyang Dreamweaver Techno...,Minimum sipariş: 40 Çift
sports,Dayanıklılık çelik ray sivri uzun ömürlü parça ...,"$1,50",Handan Shengfangzhou Tradin...,Minimum sipariş: 2 Adet
sports,Özel plastik rulo paten bisiklet bisiklet koruy...,"$7,15-10,55",Nanjing Senhongchuangsu Tra...,Minimum sipariş: 100 Adet
sports,Kol eğitimi için taşınabilir kadın katı silikon...,"$4,30-6,90",Dongguan Chenglin Sports Go...,Minimum sipariş: 1 Adet
sports,Bilek ve ayak bileği spor atletik kendinden yap...,"$0,30-0,55",Zhejiang Hongyu Medical Com...,Minimum sipariş: 2.000 Kutu
sports,Özel logo şort kadınlar popo kaldırma egzersiz ...,"$4,79-7,25",Guangzhou Tengyi Apparel Co...,Minimum sipariş: 3 Adet
sports,Kapalı ve açık Padel spor dikişsiz deneyim için...,$13.500-14.500,Nanjing Padelworker Sports ...,Minimum sipariş: 1 Takım
sports,Çok fonksiyonlu açık spor alanı çok oyun mahkem...,$8.000-9.999,Cangzhou Legend Sports Tech...,Minimum sipariş: 1 Takım
sports,Özel profesyonel karbon Fiber buz ve alan çin f...,$30-83,Jilin Province Shuocan Trad...,Minimum sipariş: 2 Adet
sports,PAIDES çok amaçlı özel Logo spor halter destek ...,"$1,29-2,58",Dongguan Paides Technology ...,Minimum sipariş: 1 Çift
sports,Magsafe paslanmaz çelik geçirmez spor içecek şi...,"$4,85-5,45","Ningbo Hoz Trading Co., Ltd.",Minimum sipariş: 1.000 Adet
sports,Naylon kaplı tel halat 7x7 7x19 tel halat spor ...,"$0,15-0,17",Jiangsu Zhongying Steel Rop...,Minimum sipariş: 1.000 Metre
sports,New Design Professional Outdoor Game Official S...,$3,Dongguan Huafusheng Sportin...,Minimum sipariş: 1.000 Adet
sports,Özelleştirilmiş boyut aşınmaya dayanıklı spor k...,$11-13,Jiangdu District Fan Chuan ...,Minimum sipariş: 50 Adet
sports,Toptan fiyat çin üretici ev jimnastik salonu 1-...,"$0,39-0,44",Nantong Baopeng Fitness Equ...,Minimum sipariş: 3.000 Pound
sports,Eski köpekbalığı işlemeli beyzbol şapkası sınır...,"$1,35-1,67",Yiwu Hanmeng E-Commerce Firm,Minimum sipariş: 20 Adet
sports,Yüksek kaliteli hava Dome spor gölgelik şişme ç...,$39-41,Wuxi Shengyixin Metal Produ...,Minimum sipariş: 20 Adet
sports,Yüksek mukavemetli hafif karbon Fiber spor ve e...,$20-23,Changsheng (langfang) Techn...,Minimum sipariş: 4 Kilogram
sports,Büyük mimari membran şişme futbol spor hava Dom...,$200,Xide Air Domes (shandong) G...,Minimum sipariş: 500 Metre Kare
sports,Erkek rahat kısa kollu Polo GÖMLEK için üst spo...,"$3,98-4,98",Shangrao Taole Shirt Clothi...,Minimum sipariş: 500 Adet
sports,2025 özel Logo spor çanta Oxford çok renkli spo...,"$7,99",Anhui Yunzhicai Clothing Co...,Minimum sipariş: 100 Adet
sports,Ev kullanımı sessiz manyetik eliptik egzersiz m...,$500,Qingdao Yingruis Fitness Te...,Minimum sipariş: 4 Takım
sports,Yetişkin spor salonu toz içecek Whey Protein kr...,"$4,50-5",GuangZhou Life Spark Biotec...,Minimum sipariş: 200 Adet
sports,Hi-q kaymaz poliolefin desenli daralan tüpler s...,"$0,03-0,05",Guangdong Weishida Material...,Minimum sipariş: 100 Metre
sports,Fabrika doğrudan satış 2 adet 4 * 3FTChildren's...,"$6,13-6,77",Huizhou Shengxiaolong Sport...,Minimum sipariş: 300 Adet
sports,Fabrika sıcak satış özelleştirilebilir Logo su ...,"$0,48",Tongcheng Huyuxia Protectiv...,Minimum sipariş: 10 Adet
sports,Tasarımcı özel güzellik geri sutyenler spor Fit...,"$5,73-7,86",Guangzhou Tengyi Apparel Co...,Minimum sipariş: 3 Adet
sports,Özel Logo saf siyah boyutu 6/7 eğitim basketbol...,"$2,85-3,28",Xiamen Chyros Sports Goods ...,Minimum sipariş: 100 Birim
sports,Ayarlanabilir PVC malzeme yetişkin atlama ipi h...,$25,"Wuxi Suowei Technology Co.,...",Minimum sipariş: 100 Adet
sports,Özelleştirilebilir Metal çok fonksiyonlu organi...,$42,Huizhou Lirui Home Furnishi...,Minimum sipariş: 200 Adet
sports,Yeni gelenler spor kadınlar katı dikişsiz spor ...,"$4,10-4,50",Zhuji Youkupai Textile Factory,Minimum sipariş: 20 Adet
sports,Erkek rahat kısa kollu Polo GÖMLEK için üst spo...,"$3,98-4,98",Shangrao Taole Shirt Clothi...,Minimum sipariş: 500 Adet
sports,2025 özel Logo spor çanta Oxford çok renkli spo...,"$7,99",Anhui Yunzhicai Clothing Co...,Minimum sipariş: 100 Adet
sports,Sıcak satış profesyonel iplik bisiklet spor kap...,"$45,97-50,23",Wuyi Xintengfa Fitness Equi...,Minimum sipariş: 10 Adet
sports,Özel Logo 5 renkler spor lateks direnç bandı Se...,"$0,38-0,47",Jiangsu Sharewin Fitness Co...,Minimum sipariş: 100 Adet
sports,Hafif 5L hidrasyon maraton sırt çantası moda su...,"$8-8,50",Hangzhou Tuoyi Sports Produ...,Minimum sipariş: 500 Adet
sports,Ganas popüler spor ekipmanları ticari kurulum s...,$774-955,Guangdong Panata Fitness Eq...,Minimum sipariş: 2 Takım
sports,Toptan renkli kinesiyoloji spor bandı su geçirm...,"$0,20-0,35",Zhejiang Hongyu Medical Com...,Minimum sipariş: 5.000 Kutu
sports,Ticari sınıf kauçuk dambıl seti spor eğitimi iç...,"$1,20-1,40",Nantong Wekeeping Co.Ltd.,Minimum sipariş: 300 Kilogram
sports,Çin fabrika ticari fitnes ekipmanları kauçuk ka...,"$1,40",Shandong Zenbon Fitness Equ...,Minimum sipariş: 500 Kilogram
sports,Birbirine PVC garaj yer karoları 5mm kaymaz geç...,"$3,90",Shandong Jiete Internationa...,Minimum sipariş: 500 Adet
sports,JSMC oyun Padel tenis kendi Padel mahkemesi kap...,$10.000,Jiangsu Mild Constant Trade...,Minimum sipariş: 1 Takım
sports,Erkek ve kadın spor eldiven halter bisiklet spo...,"$0,94-2,89",Guangzhou Nuosenlai Trading...,Minimum sipariş: 2 Adet
sports,Çok fonksiyonlu kaymaz kolları Abs Push-up kuru...,"$14,90-15,15",Shenzhen Tuorui Sports Good...,Minimum sipariş: 1 Adet
sports,Prefabrik çelik yapı stadyum spor salonu sandvi...,$25-35,Liaoning Tianying Steel Str...,Minimum sipariş: 100 Metre Kare
sports,Eğitim egzersiz ve Fitness Fit konfor için OEM ...,"$3,50-3,80",Zhongshan Xiaolan Town Kaiw...,Minimum sipariş: 500 Adet
sports,Toptan iyi fiyat Fitness gücü eğitimi halter se...,"$1,58",Rizhao Pathfer Internationa...,Minimum sipariş: 2 Kilogram
sports,Özel 500ml buzlu yumuşak dokunmatik spor fincan...,"$2,75-3,15",Quanzhou Yaochenwen Outdoor...,Minimum sipariş: 100 Adet
sports,Profesyonel ticari spor seti ekipmanları spor a...,$290-303,Shandong Meyo Sports And He...,Minimum sipariş: 1 Birim
sports,Toptan yeni kap erkek ve kadın nakış yüz alfabe...,"$2,88","Yiwu Hui Whale Trade Co., Ltd.",Minimum sipariş: 50 Adet
sports,Lijiujia elektrikli katlanır 3hp spor salonu ek...,$220-250,Zhejiang Lijiujia Sports Eq...,Minimum sipariş: 15 Karton
sports,Güç eğitimi ve vücut geliştirme için tırtıklı k...,"$0,70-0,85",Nantong Modern Sporting Ind...,Minimum sipariş: 2.000 Kilogram
sports,Toptan özel asılı örgü Sneaker tenis spor ayakk...,"$0,50","Cangnan Junda Crafts Co., Ltd.",Minimum sipariş: 1.000 Adet
sports,Büyük kapasiteli su bardağı sıcak 3 1 spor su ş...,"$0,35-0,89",Ruifeng Intelligent Manufac...,Minimum sipariş: 2 Adet
sports,Genel Medi 110 adet seyahat Survival İlk yardım...,"$5,25",Hangzhou Aosi Healthcare Co...,Minimum sipariş: 1 Adet
sports,Evde erkekler ve kadınlar için hızlı ayarlanabi...,$77-117,Shandong Maisheng Fitness E...,Minimum sipariş: 2 Takım
sports,Toptan özelleştirilebilir u-şekilli paslanmaz ç...,"$0,04-0,14",Foshan Nanhai Yingbang Unde...,Minimum sipariş: 100 Adet
sports,Spor koşu ve günlük gündelik giyim için Ultra y...,"$0,80-1,18",Hangzhou Kafuyu Trading Co....,Minimum sipariş: 200 Adet
sports,Üretici tedarikçi kinesiyoloji bandı. Spor dina...,"$1-1,20",Zhejiang Fitmild Biotechnol...,Minimum sipariş: 10.000 Rulo
sports,Yoga pantolon kadın giyim orta bel spor Fitness...,"$3,30-4,20",Shantou Nanmao Knitting Ind...,Minimum sipariş: 10 Adet
sports,1 takım içinde 3 adet 2L spor su şişesi degrade...,"$0,70",Shanxi Midas Industrial Co....,Minimum sipariş: 10 Takım
sports,Yüksek kalite koşu bandı taşınabilir masa koşu ...,$43-49,Jinhua Jingke Fitness Equip...,Minimum sipariş: 100 Adet
sports,"Egzersiz elastik bantlar seti, direnç tüpleri a...","$3,71-5,08",Shandong Crossmax Fitness C...,Minimum sipariş: 50 Adet
sports,Ayarlanabilir 5-60kg jimnastik el kavrama spor ...,"$1,05-1,72",Suzhou Zhongjian Fitness Eq...,Minimum sipariş: 20 Takım
sports,Fabrika fiyat spor Fitness profesyonel derin ka...,"$3,39-3,99",Wenzhou Feitou E-Commerce C...,Minimum sipariş: 10 Adet
sports,Ayarlanabilir omuz askısı su şişe taşıyıcı kılı...,"$9,98-10,25","Kinwo Co., Ltd.",Minimum sipariş: 500 Adet
sports,32oz plastik spor salonu motivasyon şişe Bpa üc...,"$0,97-1,89",Hangzhou Ownerparty Gift Co...,Minimum sipariş: 50 Adet
sports,Sıcak satış moda Unisex büyük kapasiteli kısa m...,"$5,60-6,12","Yiwu Haike Luggage Co., Ltd.",Minimum sipariş: 100 Poşet
sports,Özel toptan PVC su geçirmez yağmurluk açık için...,"$2,70",Tongcheng Huyuxia Protectiv...,Minimum sipariş: 3 Adet
sports,Orta okul için sprey ceket kauçuk koşu parkuru ...,$7-10,Guangzhou Henghui Sports Fa...,Minimum sipariş: 50 Metre Kare
sports,Toptan anti-sonbahar eğitim makinesi Gait anali...,$12.800-14.800,Xinmai (quanzhou) Digital T...,Minimum sipariş: 1 Takım
sports,Yüksek kalite özel erkek pantolon pantolon Poly...,"$13,90-16,80","Dongguan Nayi Garment Co., ...",Minimum sipariş: 50 Adet
sports,Toptan kişiselleştirilmiş atletik yetişkin Fans...,"$7,25-13,47",Zhongshan Champsarmour Spor...,Minimum sipariş: 5 Adet
sports,Cheap Custom Logo Plastic Ballpoint Pen Novelty...,"$0,17",Hangzhou Xinhao Stationery&...,Minimum sipariş: 100 Adet
sports,DW spor salonu Hex Dumbbells kauçuk kaplı katı ...,"$0,90-0,99",Nantong Doublewin Import An...,Minimum sipariş: 500 Kilogram
sports,Yeni şık çerçevesiz büyük çerçeve dışında Metal...,"$2,49",Linhai City Zhenqi Eyewear ...,Minimum sipariş: 3 Adet
sports,Jel silikon kalınlaşmış spor konfor tabanlık ka...,"$1,47-1,61",Wenzhou Zhuoyue New Materia...,Minimum sipariş: 2 Çift
sports,Yüksek kalite lüks özel logo moda kare TR90 gün...,"$2,40","Linhai Kangrui Eyewear Co.,...",Minimum sipariş: 4 Adet
sports,Spor toptan özel logo yüksek kaliteli lateks 11...,"$9,70-10,70",Shenzhen Keleer Technology ...,Minimum sipariş: 100 Adet
sports,BPA ücretsiz Flip Top Frosted buzlu yarım galon...,"$1,69-1,99",Shenzhen Mlife Plastic Hard...,Minimum sipariş: 2 Adet
sports,OEM/ODM 800ml mavi gri TPU katlanır katlanabili...,$8-9,Xiamen Mizipure Purificatio...,Minimum sipariş: 2 Adet
sports,Toptan polyester ayak bileği kol özelleştirilmi...,"$0,70-0,75",Yangzhou Sensport Healthcar...,Minimum sipariş: 1.000 Adet
sports,"Shuanglang spor sapları, kaymaz, ter-emici, yum...","$1,30-1,49",Lu'an Shuanglang Sports Goo...,Minimum sipariş: 50 Kutu
sports,Yeni stil Smith makinesi spor ekipmanları çok f...,$362-624,"Anhui Tap E-Commerce Co., Ltd.",Minimum sipariş: 1 Adet
sports,Katlanabilir silikon su şişesi genişletilebilir...,"$2,80",Ninghai Jianning Rubber Mou...,Minimum sipariş: 20 Adet
sports,Basketbol kas kinesiyoloji bandı için spor 95% ...,"$0,12-0,16",Wenzhou Anqi Medical Suppli...,Minimum sipariş: 1 Adet
sports,Çift Ab tekerlek kişisel spor Abs rulo egzersiz...,"$6,20",Wenzhou Machalon Trading Co...,Minimum sipariş: 5 Adet
sports,Toptan ferahlatıcı Spf 50 açık UVA/UVB koruma d...,"$1,72",Guangzhou Liangxin Cosmetic...,Minimum sipariş: 240 Adet
sports,5 Packs hız çeviklik eğitim seti çeviklik merdi...,"$9,25-10,50",Nantong Vigor Sport Goods C...,Minimum sipariş: 200 Takım
sports,Hızlı kuru erkekler koşu tişörtü Fitness spor ü...,"$5,50",WANG YIP INTERNATIONAL TRAD...,Minimum sipariş: 2 Adet
sports,"Kapalı açık aşırı eğitim fayans 12 ""x 12"" Dryla...",$1,Zhangjiagang Kingway Import...,Minimum sipariş: 15 Adet
sports,Spor dizkapağı buzağı zayıflama şekillendirici ...,"$2,50-3",Yangzhou Changqingshu Sport...,Minimum sipariş: 100 Adet
sports,Ucuz özel spor Fitness ekipmanı altıgen dambıl ...,"$0,97-1,02",Nantong Duojiu Sporting Goo...,Minimum sipariş: 500 Kilogram
sports,Tam spor ekipmanları toptan yüksek kaliteli ant...,$988,Guangdong Yoma Fitness Tech...,Minimum sipariş: 1 Adet
sports,Ahşap taşınabilir sabit sistem için basketbol k...,$40-90,Liaoning NB Sports Developm...,Minimum sipariş: 100 Metre Kare
sports,JIEJIN yeni varış bayanlar atletik aşınma Golf ...,"$12,20-14,90",Dongguan Jiejin Security Pr...,Minimum sipariş: 100 Takım
sports,Akıllı AI Bluetooth güneş gözlüğü açık kulak ho...,"$4,80-5,50",Shenzhen Qiao Communication...,Minimum sipariş: 3.000 Birim
sports,Fitness egzersiz yeni LED akıllı sayma kalça eğ...,"$6,07-10",Suzhou Zhongjian Fitness Eq...,Minimum sipariş: 20 Takım
sports,Toptan öğrenci sırt çantası erkek seyahat sırt ...,"$2,50-3,50",Anhui Three Six Seven Trave...,Minimum sipariş: 30 Adet
sports,Baskı doku ile basketbol oem basketbol resmi öz...,"$3,09-3,34",Huafei Sporting Goods Co. L...,Minimum sipariş: 1 Adet
sports,Özel Logo spor giyim Polyester teknoloji polar ...,"$22,40-24,90","Yiwu Reji Clothing Co., Ltd.",Minimum sipariş: 100 Adet
sports,Sporcular sıkıştırma kolu manşonu nefes alabile...,"$1,83-2,01","Yiwu Relief Knitting Co., Ltd.",Minimum sipariş: 300 Çift
sports,Benken yetişkin Fitness koruyucu dirsek pedleri...,"$3,05-3,28",Hunan Sports And Health Spo...,Minimum sipariş: 2 Adet
