Kategori,Ürün Adı,Fiyat,Satıcı,Minimum Sipariş
textile,Işlemeli kumaş ile yüksek kaliteli pamuk disk t...,"$3,58",Zhejiang Shangsheng Imp & E...,Minimum sipariş: 25 Yarda
textile,Dijital baskı 100% saf pamuk Poplin yüksek kali...,"$2,50-4,50",Shaoxing Yecaifeng Textile ...,Minimum sipariş: 1 Metre
textile,Toptan Polyester gagirls düz ipek yüksek yoğunl...,$1-3,Dalian Benjiu Garment Acces...,Minimum sipariş: 1 Metre
textile,Kumaş,"$1-1,25",STYLE IN TEXTILE,Minimum sipariş: 20.000 Metre
textile,300D tek dokuma viskon Rayon kumaş eldiven yıka...,"$3,10","Hangzhou Leyuan Silk Co., Ltd.",Minimum sipariş: 1.000 Metre
textile,Yüksek kaliteli toptan düz dokuma % 100% pamuk ...,"$5,50",Shaoxing Rongbao Textile Co...,Minimum sipariş: 1 Metre
textile,Kanepe loveseat kanepe lideri için dokuma kumaş...,"$2,92-3,28","Shanghai Vega Fabrics Co., ...",Minimum sipariş: 1.000 Metre
textile,Özel tasarımcı desen ekran baskı tekstil saf pa...,"$7,45-8,38",Shaoxing Ika Textile Tradin...,Minimum sipariş: 1 Metre
textile,Sıcak satış yeni armürlü tasarım pamuklu kumaş ...,"$2,36-2,86",Changzhou Saishi Internatio...,Minimum sipariş: 500 Metre
textile,Yüksek kaliteli 92% Polyester % 8% Spandex 350g...,"$11,50-12,50",Fujian Sar International Tr...,Minimum sipariş: 400 Kilogram
textile,Shaoxing mango tekstil konfeksiyon için örme % ...,$1-3,Shaoxing Mango Textile Impo...,Minimum sipariş: 50 Metre
textile,UOO çin 2.0mm renkli neopren tekstil kumaş Lycra,"$2,90-22,60",UOO INDUSTRY LLC,Minimum sipariş: 165 Metre
textile,Fabrika toptan pamuk polar kumaş pamuk kapüşonl...,"$3,40",Guangdong Yitong Textile Te...,Minimum sipariş: 2 Metre
textile,Yeni tekstil malzemesi bez shrink dayanıklı dim...,"$1,40-1,60",Guangzhou Caizhi Textile Ma...,Minimum sipariş: 6 Yarda
textile,Çin toptan % 100% pamuk Poplin tasarımcı kumaş ...,"$4,80",Shaoxing Kuangheng Import A...,Minimum sipariş: 20 Metre
textile,Tekstil malzemesi hafif polyester kumaş tedarik...,"$0,63-1,10",Shijiazhuang Hongxing Texti...,Minimum sipariş: 2.800 Metre
textile,Kahn stok tekstil gri düz çim kumaş vual pamuk ...,"$1,95-8",Shaoxing City Kahn Trade Co...,Minimum sipariş: 1 Yarda
textile,Kaliteli yırtılmaz boyama dokuma dimi kumaş tek...,"$1,80-2",Wuhan Fronter Industrial Co...,Minimum sipariş: 5.000 Metre
textile,Uzun vadeli nokta kaynağı gemi hazır streç span...,"$1,64-1,68",Sichuan Yilong Technology T...,Minimum sipariş: 1 Metre
textile,Kenevir karışımlı kumaşlar stok örnekleri kitap...,"$129,90",Hemp Fortex Industries Ltd,Minimum sipariş: 1 Takım
textile,Düz boyalı desen hafif tekstil hammadde alışver...,"$1,15-1,25",A A CANVAS COMPANY,Minimum sipariş: 500 Metre
textile,Tekstil malzemeleri özelleştirmek düz boyalı Po...,"$3,52-7,81",Foshan Yuexiu Home Furnishi...,Minimum sipariş: 1 Metre
textile,Stok Lot tekstil kumaş dokuma dimi endüstriyel ...,"$1,90",Shaoxing Mindun Textile Co....,Minimum sipariş: 1 Metre
textile,XITONG tekstil dokuma kumaş tedarikçiler 4 yoll...,"$1,95-2,10","Suzhou Xitong Textile Co., ...",Minimum sipariş: 1.000 Metre
textile,Giyim tekstil için yüksek kaliteli kumaşlar Pol...,"$1,58",Zhengzhou Longjin Textile C...,Minimum sipariş: 1.000 Metre
textile,Toptan % 100 pamuk düz pantolon için dokuma des...,"$0,50-1,58",Baodingshi Tianma Interlini...,Minimum sipariş: 3.000 Metre
textile,100% polyester jakar moda tekstil kumaşları,"$1,60-2",Guangzhou Yili Fabric Indus...,Minimum sipariş: 100 Metre
textile,2020 yeni tasarım streç dokuma bükülmüş kumaşla...,"$1,42-1,68",Shaoxing City Kahn Trade Co...,Minimum sipariş: 1.200 Yarda
textile,Japon sandalye malzemeleri eşofman kumaş teksti...,$45-60,"TAENAKA PILE FABRICS co.,ltd.",Minimum sipariş: 300 Metre
textile,Çiçek Modern el bloğu baskılı kumaş Mulmul % 10...,$2-3,DVK HANDICRAFTS,Minimum sipariş: 10 Metre
textile,T 90GSM kumaş tekstil elbise için 100% Polyeste...,"$1,85-1,92",Hangzhou Mengda Industry Co...,Minimum sipariş: 3.000 Metre
textile,Nanyee tekstil stokta kelebekler tül destek 3d ...,$4-6,Shaoxing Nanyee Textile Co....,Minimum sipariş: 10 Metre
textile,Yüksek kalite hiçbir adedi özel tasarım Lyocell...,"$2,98","Changzhou Boqi Textile Co.,...",Minimum sipariş: 1 Metre
textile,Tekstil kumaş üreticisi polyester pamuk kontrol...,"$2,88-3,56","Hebei Pofeng Textile Co., Ltd.",Minimum sipariş: 2 Metre
textile,Fabrika satış stok kumaşlar çok ucuz özel hızlı...,"$2,35","Suzhou Renyu Textile Co., Ltd.",Minimum sipariş: 1.000 Metre
textile,Ipek saten kumaşlar giyim elbiseler astar kumaş...,"$0,39-0,59","Jiaxing Hongyi Textile Co.,...",Minimum sipariş: 1.000 Metre
textile,Kingcason Polyester 270g 280g jakarlı moda teks...,"$0,40-1,20",Changzhou Kingcason Printin...,Minimum sipariş: 1.000 Kilogram
textile,Oxford kumaş stokta mevcuttur ve örnekleri 600D...,"$1,10",Suzhou Xinjinyuan Textile C...,Minimum sipariş: 1 Metre
textile,İtalyan ağır dijital baskı organik özel yard ha...,"$18,50-23,50","Guangzhou Hengyun Silk Co.,...",Minimum sipariş: 1 Metre
textile,Fabrika kaynağı Polyester kumaş çin ev tekstili...,"$1,65-2,10",Shijiazhuang Longshow Home ...,Minimum sipariş: 5.000 Metre
textile,Beautifical pamuk baskılar 6 yards kumaş giysi ...,"$2,30",Guangzhou Mainlei Trading C...,Minimum sipariş: 60 Yarda
textile,Toptan ucuz baskılı kumaş konfeksiyon tekstil n...,"$1,50-3",Suzhou Topstex Technology C...,Minimum sipariş: 1 Metre
textile,Hanlin tekstil 100 Polyester Spandex yumuşak st...,"$0,59-0,70","Hebei Hanlin Textile Co., Ltd.",Minimum sipariş: 2.000 Metre
textile,Yüksek kaliteli yaz giyim kumaşlar 100s * 100s ...,"$4,50-5,28",Guangzhou Xiaozhima Textile...,Minimum sipariş: 1 Metre
textile,Fabrika fiyat xinlihao tekstil 100 Polyester ev...,"$0,39-0,69",Changxing Xin Li Hao Textil...,Minimum sipariş: 1 Metre
textile,Baskı ham renk Greige kumaş için tekstil Polyes...,"$0,46-0,60","Hebei Gaibo Textile Co., Ltd.",Minimum sipariş: 3.000 Metre
textile,Yeni moda 100% pamuk 213TC 40s * 40s nefes malz...,"$1,96",Nantong Fuxinlong Textile C...,Minimum sipariş: 2.000 Metre
textile,Sıcak satış ürünleri tüm pamuk suda çözünür nak...,"$8,70",Zhejiang Shangsheng Imp & E...,Minimum sipariş: 25 Yarda
textile,Özelleştirilebilir % 100% Polyester kumaş çabuk...,"$2,06-3,44",Shaoxing Huangzu Textile Co...,Minimum sipariş: 10 Metre
textile,Süper sıcak satış pamuk ipliği boyalı kumaş min...,"$1,50-2",Nantong Wang& Sheng Textile...,Minimum sipariş: 1.000 Metre
textile,Sıcak satış dokuma kumaşlar lot stok baskılı ku...,"$1,05",Ningbo Main Force Internati...,Minimum sipariş: 140 Metre
textile,Çin tekstil özel baskılı dokuma dimi giyim kuma...,"$1,70-1,75",Qingdao Maino Ruipu Industr...,Minimum sipariş: 20 Metre
textile,Yeni moda giysi 97% Polyester 3% Rayon siyah te...,"$3,80-4,20",Shaoxing Zhenlei Textile Co...,Minimum sipariş: 500 Metre
textile,Yüksek kalite parlak 1.0MM Vintage kabartmalı P...,"$1,99-3,99",Shenzhen Huajin Leather Co....,Minimum sipariş: 500 Metre
textile,% 100% jüt kumaş doğal çuval bezi çuval bezi (J...,"$1-1,60","Zhejiang Jiahe Textile Co.,...",Minimum sipariş: 500 Metre
textile,Giyim giysiler için toptan kumaşlar dokuma kuma...,"$0,19-0,21",Hangzhou Hongxuan Textile C...,Minimum sipariş: 10.000 Metre
textile,Çin tekstil özelleştirilmiş kumaş pamuk % 100% ...,"$32,90",Guangzhou Inmyshop Clothing...,Minimum sipariş: 1 Adet
textile,Önde gelen tekstil kumaş fabrikası tekstil üret...,"$1,40-1,80",Haining Haida Warp Knitting...,Minimum sipariş: 800 Metre
textile,Nokta mal çeşitli renkler kumaş ve tekstil hamm...,"$5,01-5,25",Dongguan Forward Textile Co...,Minimum sipariş: 12 Kilogram
textile,"Toptan dokuma kumaşlar, mobilya tekstil için te...","$1,35","XINHUA TEXTILE CO.,LIMITED",Minimum sipariş: 1.000 Kilogram
textile,% 100% pamuk düz giyim tekstil kumaş yapışkan tela,"$0,75-0,85",Nantong King Monkey Interli...,Minimum sipariş: 2.000 Metre
textile,Polyester ev tekstili kumaşı soyut baskılı 105g...,"$7,80",Shen Zhen Junsheng Textile ...,Minimum sipariş: 10 Adet
textile,BC006 düşük fiyat tekstil kumaşı  örme üniforma...,"$5,29",Guangzhou Qingqing Trading ...,Minimum sipariş: 25 Kilogram
textile,Büyük % 100% Polyester kumaş yüksek kalite doku...,$2-4,Hangzhou Zhiyue Import And ...,Minimum sipariş: 1.200 Kilogram
textile,T400 Twill Cool Silk Cotton Is a Textile Fabric...,"$1,90-2",Suzhou Muhui Textile Materi...,Minimum sipariş: 1.000 Metre
textile,Yüksek kalite popüler Cupro viskon saten bezler...,"$6,90-7,80",Zhejiang Yinmao Import & Ex...,Minimum sipariş: 100 Yarda
textile,Giysiler için keten dokuma kumaşlar çok renkli ...,"$1,05-1,15",SUZHOU SANSAN IMPORT AND EX...,Minimum sipariş: 100 Metre
textile,TXT tekstil % 100% naylon İplik boyalı desen; N...,"$2,30-4",FIBRXL ITALY S.R.L.,Minimum sipariş: 300 Kilogram
textile,Hasat hafif dokuma organik 40s pamuk poplin kat...,$3,Shaoxing Keqiao Harvest Tex...,Minimum sipariş: 2 Metre
textile,Fabrika doğrudan satış % 100% pamuklu ekose jak...,"$2,55-3,25","Suzhou Woying Textile Co., ...",Minimum sipariş: 50 Metre
textile,Kalın polyester streç örgü spor giyim kumaşlar ...,"$1,70-1,85","Haining Henry Textile Co., ...",Minimum sipariş: 3.000 Yarda
textile,Stokta hazır mal dokuma tekstil kumaş fabrika y...,"$1,68",Sichuan Yilong Technology T...,Minimum sipariş: 1 Metre
textile,% 100% organik pamuk kambrik kumaş balmumu gıda...,"$7,10-12",Shaoxing Senboo Textile Ltd.,Minimum sipariş: 1 Metre
textile,Çin'de üretilen 2024 sıcak satış yüksek kalitel...,"$3,19",Hunan Huasheng Industrial A...,Minimum sipariş: 10 Metre
textile,Giyim için promosyon yüksek kaliteli kumaş ve t...,"$6,90",Shengzhou Eagle Necktie And...,Minimum sipariş: 2 Metre
textile,Toptan yüksek kalite için dokuma kumaşlar dokum...,"$2,45","Haining Weipai Textile Co.,...",Minimum sipariş: 1.100 Metre
textile,Elbiseler gömlek dokuma desen tasarımı için 100...,"$1,55-1,72",Guangzhou Haizhu District F...,Minimum sipariş: 10 Metre
textile,Su geçirmez kumaş UV koruma 100% Polyester kuma...,"$4,48-4,56",Wenzhou Sing-Rui Internatio...,Minimum sipariş: 500 Metre
textile,55% keten % 45% pamuk % baskılı kumaş Premium t...,"$3,46-5,32","Shaoxing Tex Trading Co., Ltd.",Minimum sipariş: 500 Kilometre
textile,Kumaş tekstil keten organik fabrika toptan düz ...,"$5,98",Guangzhou Henry Textile Tra...,Minimum sipariş: 100 Yarda
textile,Su geçirmez kaliteli tekstil düz örgü dimi kuma...,"$2,99-4,69",Guangzhou Saian Trading Co....,Minimum sipariş: 1 Yarda
textile,XYH toptan renk özel tekstil % 100% pamuk bci p...,"$1,48",Hubei Xiangyinhong Textile ...,Minimum sipariş: 1.000 Metre
textile,Howmay 36 m/M 45% S 55% W dimi ipek yün karışık...,"$16,99","Hangzhou Howmay Silk Co.,LTD",Minimum sipariş: 100 Yarda
textile,Toptan pamuk kanvas dokuma kumaş ağır dayanıklı...,"$1,65-1,98",Yanmao Textile Technology C...,Minimum sipariş: 500 Metre
textile,Çin üretici tekstil katı düz Modal dijital bask...,"$2,59-4,89","Jihua 3542 Textile Co., Ltd.",Minimum sipariş: 500 Metre
textile,Yüksek kalite çin tekstil kumaş kumaş giyim içi...,"$5,30-7,38",Shaoxing Pengan Import&Expo...,Minimum sipariş: 6 Metre
textile,Sıcak satış şerit renkli polyester pamuk ipliği...,$3-6,Shaoxing Baocai Digital Pri...,Minimum sipariş: 5 Metre
textile,Polyester naylon ev tekstili kumaşı Guangzhou J...,"$2,85",Guangzhou Jiayu Textile Co....,Minimum sipariş: 1 Metre
textile,Polyester iplik kumaş tekstil hammadde deri kan...,"$3,45-3,50",Tongxiang Sinovel Textile C...,Minimum sipariş: 1.000 Metre
textile,Çin tekstil polyester dokuma düz boyalı çift yü...,"$0,12-0,14",Shaoxing Keqiao Pinyi Texti...,Minimum sipariş: 3.000 Metre
textile,Tekstil atkı dokuma ipliği boyalı 150 torba giy...,"$6,50","Yiwu Fengju E-Commerce Co.,...",Minimum sipariş: 3 Yarda
textile,Kadınlar için özel düz dijital çiçek baskılı do...,"$1,50-4,80",Wujiang Beytown Textile Ind...,Minimum sipariş: 1 Metre
textile,Kumaş,"$3,80-4",STAR SILK EXPORTS PRIVATE L...,Minimum sipariş: 100 Metre
apparel,MT2518 yeni stiller toptan özel 310g Raglan kol...,"$8,90-12,70",Guangzhou Panyu District La...,Minimum sipariş: 50 Adet
apparel,"Ev, veteriner kliniği ve hastane kullanımı için...",$4-6,Zhongcan Pet Products (Taia...,Minimum sipariş: 200 Adet
apparel,Fishprincess lüks sevimli yeni kış köpekler giy...,"$1,20-2,20",Hengyuejia Pet Products (Sh...,Minimum sipariş: 30 Adet
apparel,Özel toptan PVC su geçirmez yağmurluk açık için...,"$2,70",Tongcheng Huyuxia Protectiv...,Minimum sipariş: 3 Adet
apparel,Golf İş kıyafetleri için baskılı logolu özel et...,"$16,90","Hunan Jinxing Apparel Co., ...",Minimum sipariş: 1 Adet
apparel,Erkek rahat Hip-Hop kazak kolsuz yelek üst kapu...,"$1,35-1,75",Ningbo Benjialun Clothing C...,Minimum sipariş: 2 Adet
apparel,"Stokta yeni stil sonbahar, kış ve yaz erkekler ...","$1,20-2,39",STUDIO ASSOCIATO MIRAGLIA &...,Minimum sipariş: 1 Kutu
apparel,Nefes spor toptan Yoga Backless spor özel koşu ...,"$5,29-7,96",Guangzhou Tengyi Apparel Co...,Minimum sipariş: 5 Adet
apparel,Ikinci el markalı tasarımcı Mix tarzı giysi kul...,"$0,39-0,80",Guangzhou Gracer Renewable ...,Minimum sipariş: 45 Kilogram
apparel,Özelleştirilebilir Logo endüstriyel güvenlik ye...,"$1,99",Qianhai Fangduo Technology ...,Minimum sipariş: 50 Adet
apparel,Toplu giysi karışımı toplu balya üstleri balya ...,"$1,12-1,43",Guangdong Jingran Environme...,Minimum sipariş: 1.000 Adet
apparel,Yüksek kaliteli asit yıkama Vintage grafik Unis...,"$8,80-11,90","Dongguan Nayi Garment Co., ...",Minimum sipariş: 50 Adet
apparel,2024 toptan giysi fabrika indirim stok giyim çe...,"$0,70-0,99",Shenzhen Yiming Clothing Co...,Minimum sipariş: 100 Adet
apparel,En iyi fiyat çatı PPGI Sheet sac oluklu levha g...,$590-610,Shandong Baotai Metal Mater...,Minimum sipariş: 1 Ton
apparel,Marka toplu giyim büyük indirim bayan elbise ta...,"$0,39-0,99",Fuzhou Jin 'an District Xia...,Minimum sipariş: 1 Akre
apparel,Yüksek kaliteli elastik kaput tıbbi koruyucu kı...,"$0,50-0,60",Xiantao Aoya Protective Equ...,Minimum sipariş: 1.000 Adet
apparel,Toptan giysi fabrika indirim stok giyim çeşitli...,"$0,10-0,99",Fuzhou High-Tech Zone Yujia...,Minimum sipariş: 2 Adet
apparel,2023 marka toplu giyim büyük indirim bayanlar e...,"$0,59-0,99",Fuzhou Xiangwang Trading Co...,Minimum sipariş: 2 Adet
apparel,Giyim stok Lot bangladeş markalı Overruns stok ...,"$0,98-1,01",Sichuan Miracle Technology ...,Minimum sipariş: 200 Adet
apparel,2025 marka yeni en kaliteli kadın giyim balya g...,"$1,78-2,09",No.8 Shop (beijing) Interna...,Minimum sipariş: 50 Adet
apparel,Thrift mağaza giysi 1St seçim toptan kullanılan...,"$0,50-1,20",Wenzhou Hongyang Trading Co...,Minimum sipariş: 200 Kilogram
apparel,Amerikan sıcak aile oturma katlanır odası yatak...,$4.560-4.999,Guangzhou Qianguang Technol...,Minimum sipariş: 1 Adet
apparel,Küçük adedi CMT Oem yüksek kaliteli giyim özel ...,$9-22,Y&L FASHION FACTORY LIMITED,Minimum sipariş: 10 Adet
apparel,Ev taşınabilir Automic elektrikli dikiş giysi m...,"$5,07",Jiangmen Jiayi Electric App...,Minimum sipariş: 20 Adet
apparel,2025 çeşitli stilleri giyim stok kız ve erkek g...,"$2,28",Guangzhou Ershou Clothing T...,Minimum sipariş: 100 Adet
apparel,Labubu aksesuarları giysi tasarımcısı canavar k...,"$1,99-2,58","Yangzhou Jijia Toys Co., Ltd.",Minimum sipariş: 500 Adet
apparel,Stok giyim fabrika doğrudan elbise kısa kollu e...,"$0,99",Fuzhou Gulou District Mingm...,Minimum sipariş: 2 Adet
apparel,PAIDES toptan hafif yalıtımlı WarmingUnisex USB...,"$12,50",Dongguan Paides Technology ...,Minimum sipariş: 2 Adet
apparel,Giyim stok marka yeni Mix balya giysi kadın var...,"$0,99",Shenzhen Hengliyuan Technol...,Minimum sipariş: 100 Adet
apparel,Toptan çocuk yaz giyim kısa kollu rahat gömlek ...,"$3,80",Zaozhuang Puyi Internationa...,Minimum sipariş: 250 Kilogram
apparel,Amerikan giyim stok Offprice giyim abd boyutlar...,"$1,80",POLO INTERNATIONAL LIMITED,Minimum sipariş: 500 Adet
apparel,OEM ve ODM T-Shirt işleme hizmeti özelleştirilm...,$7-10,DUC PHAT GARMENT AND TRADIN...,Minimum sipariş: 2 Adet
apparel,Premium Vip giyim stok balya 45 Kg karışık giyi...,"$0,60-1,20",Jiang Su Jinmao Environment...,Minimum sipariş: 500 Kilogram
apparel,2024 toptan kadın giyim stok Lot artık closeout...,"$0,70","Quanzhou Deguo Trading Co.,...",Minimum sipariş: 120 Adet
apparel,Bangladeş giyim stok Lot markalı taşmalar gönde...,"$1,50-2,60",MARSS OUTWEAR CREATION,Minimum sipariş: 130 Adet
apparel,Stocklots giyim giyim gündelik giyim,"$5,90-6,50","Jinjiang Dadi Garment Co., ...",Minimum sipariş: 500 Adet
apparel,Toptan elbise giyim stok kadınlar karışık düşük...,"$0,10-0,99","Fuzhou Ecoly Trading Co., Ltd.",Minimum sipariş: 1 Adet
apparel,Erkekler için çeşitli toplu giyim moda toptan g...,"$1,90-2,90",CHINA BANGLA EXPORT IMPORT,Minimum sipariş: 200 Adet
apparel,Premium giyim stok balya çocuk çeşitli yeni erk...,"$0,99-1,99",Guangzhou Tianyu Trading Co...,Minimum sipariş: 100 Adet
apparel,Karışık yüksek kaliteli yay yaz erkek ve kız iç...,"$0,65-0,74","Shanghai Kenbi Trading Co.,...",Minimum sipariş: 300 Adet
apparel,Erkekler için çeşitli toplu giyim moda toptan g...,"$1,80-2,80",AN Fashion BD,Minimum sipariş: 50 Adet
apparel,Stok giyim fabrika doğrudan elbise kısa kollu e...,"$0,99",Fuzhou Cangshan Yanyanjia I...,Minimum sipariş: 2 Adet
apparel,Gümrükleme erkek kadın giysileri toptan rahat e...,"$2,40-2,90",MARSS OUTWEAR CREATION,Minimum sipariş: 200 Adet
apparel,Moda kullanılan giysiler satıcıları toplu giysi...,"$0,90-1,30",Guangzhou Gracer Renewable ...,Minimum sipariş: 45 Kilogram
apparel,Ucuz giysiler giyim fazlası stok artık iç çamaş...,"$0,54","Yiwu Maining Trading Co., Ltd.",Minimum sipariş: 50 Adet
apparel,Karışık stil elbise marka indirim kadın giyim s...,"$0,49-0,99","Fuzhou Youbei Trading Co., ...",Minimum sipariş: 1 Adet
apparel,"OEM & ODM Golf and Tennis Wear, Including Custo...",$7-10,TIEN PHONG SPORT TECHNOLOGY...,Minimum sipariş: 30 Adet
apparel,Fabrika giyim giyim stok Shien ve lovibundle ka...,"$1,79-2,06",American Pacific Rim Luxury...,Minimum sipariş: 100 Adet
apparel,Yaz giyim seti ile tulumları pamuk erkek ve kız...,"$1,50-1,75",Yiyang Beishufu Trading Co....,Minimum sipariş: 3 Adet
apparel,Fabrika özelleştirilmiş yuvarlak boyun T-Shirt ...,"$7,29-12,15","Dongguan Nayi Garment Co., ...",Minimum sipariş: 50 Adet
apparel,Markalı kullanılan giysiler yaz rahat kadın giy...,"$1,17-1,37",Nantong Youzi Environmental...,Minimum sipariş: 35 Kilogram
apparel,Yaz erkek kısa kollu T-shirt rahat iş moda gevş...,"$4,28-5,98",Shangrao Taole Shirt Clothi...,Minimum sipariş: 500 Adet
apparel,Ihracat fazlası stokları giysiler yeni giyim er...,"$7,99",Longbaihui Garment & Weavin...,Minimum sipariş: 1.000 Adet
apparel,Erkek yaz kısa kollu tişört 230g All-Cotton Vin...,"$2,50-2,92",Zhongshan Champsarmour Spor...,Minimum sipariş: 2 Adet
apparel,Giyim stok giysi tedarikçisi toptan kadınlar iç...,"$0,50-1,50",Wenzhou Hongyang Trading Co...,Minimum sipariş: 300 Kilogram
apparel,Yüksek kaliteli köpek bornoz havlu bornoz pet b...,"$1,51-1,82",Gaizhou Lihebo Pet Products...,Minimum sipariş: 50 Adet
apparel,Toptan ikinci el kadın giyim kullanılan pamuklu...,"$0,90-1",Shenzhen Antique Technology...,Minimum sipariş: 50 Adet
apparel,Fabrika giyim tedarikçisi 2023 yığınlar marka y...,"$1,09-1,99",Shenzhen Jixin Technology C...,Minimum sipariş: 200 Adet
apparel,Karışık stil elbise marka indirim kadın giyim s...,"$2,60",Quanzhou Zhukuanghong Garme...,Minimum sipariş: 10 Adet
apparel,Php içinde 2024 sıcak satış fabrika doğrudan sa...,"$0,49-0,99",Xiamen Bidebao Import And E...,Minimum sipariş: 2 Adet
apparel,Erkek gömlek markalı doğrulanmış hindistan olma...,"$6,50-6,70",RATCHEL ENTERPRISES,Minimum sipariş: 300 Adet
apparel,Envanter gümrükleme erkek giyim toptan kısa kol...,"$0,70-0,99",Guangzhou BLM Import and Ex...,Minimum sipariş: 100 Adet
apparel,2024 moda giyim yüksek kalite toptan erkek günl...,"$0,49-0,99",Fuzhou Linghuancai Trading ...,Minimum sipariş: 2 Adet
apparel,Kullanılan bez toptan yığınlar marka yeni balya...,"$0,59-0,99",Fuzhou Jin 'an District Mor...,Minimum sipariş: 1 Akre
apparel,Toptan düşük fiyat kadın giyim kadın bluzları ç...,"$0,99",Nanchang Finery Clothing Co...,Minimum sipariş: 50 Adet
apparel,Giyim fazlası stok lot artık Overrun erkekler k...,"$0,99",Fujian Surprise Network Tec...,Minimum sipariş: 500 Adet
apparel,Otantik markalı giyim orijinal stok giyim topta...,"$4,98",Guangzhou Spade Clothing Fi...,Minimum sipariş: 2 Adet
apparel,Giyim stok kullanılan kadın giyim T Shirt ikinc...,"$4,99",Guangzhou Mige Sport Clothi...,Minimum sipariş: 3 Adet
apparel,Kadın yaz giyim toptan yeni stok toplu balya fa...,"$1,50-1,60",Guangzhou 1868 Import And E...,Minimum sipariş: 50 Adet
apparel,Giyim,"$5,50",STYLE IN TEXTILE,Minimum sipariş: 5.000 Kilogram
apparel,"Giyim stok lot, mont ve ceket stok lot, kaynak ...",$2-8,MEKONG DELTA IMPORT EXPORT ...,Minimum sipariş: 10.000 Adet
apparel,Giysi toptan giysi fabrika indirim çeşitli topl...,"$0,20-1",Guangdong Hissen Renewable ...,Minimum sipariş: 450 Kilogram
apparel,2025 fabrika indirim stok giyim toptan giyim üs...,"$0,70-0,85",Guangzhou Congzong Trading ...,Minimum sipariş: 500 Adet
apparel,Katı renk yüksek kaliteli bangladeş giyim topta...,"$1,50-1,90",HAQUE TEXTILE,Minimum sipariş: 1.000 Adet
apparel,Giysi toptan tedarikçisi yüksek kaliteli 45kg 5...,"$1-1,50",Guangzhou Riching Renewable...,Minimum sipariş: 2.250 Kilometre
apparel,Fabrika doğrudan kore vip balya karışık kadınla...,"$1,30-3,82",Geyu Technology (guangzhou)...,Minimum sipariş: 45 Kilogram
apparel,Bales doğrudan toplu olarak bayanlar için giyim...,"$307,44",BV JR TRADING,Minimum sipariş: 10 Ton
apparel,Erkek gömlek Overrun Overstock artık High End m...,"$2,50","Yiwu Hantao Trading Co., Ltd.",Minimum sipariş: 120 Adet
apparel,Toptan bayan 2025 tedarikçisi marka yeni üstler...,"$0,60-1,80",Quick Food LLC,Minimum sipariş: 2.000 Pound
apparel,Parça başına kullanılan marka giysi markalı giy...,"$1,72-3,15",Guangzhou Hissen Internatio...,Minimum sipariş: 450 Kilogram
apparel,Yeni ambalaj giyim giyim stok toptan yığınlar m...,"$1,30-1,50",Shenyang Yuhong Xinpengyang...,Minimum sipariş: 12.600 Kilogram
apparel,Ucuz moda elbiseler stok sürü giyim marka giyim...,"$0,45-0,63",Shanghai Sanheng Internatio...,Minimum sipariş: 500 Adet
apparel,Yüksek kalite uygun fiyat kullanılan erkekler y...,"$1,90",AUSTRALASIA RECYCLING SDN. ...,Minimum sipariş: 225 Kilogram
apparel,Düşük fiyat toptan ucuz bayan giyim toplu giyim...,"$0,10-1",Guangdong Zagumi Renewable ...,Minimum sipariş: 450 Kilogram
apparel,Giyim stok erkek yüksek kaliteli aşırı stokları...,"$1,50-3,20",Dongguan Tongyuan Garment C...,Minimum sipariş: 100 Adet
apparel,Giyim üreticisi kadın giyim yüksek bel pileli m...,"$11,50","Dongguan Worui Garment Co.,...",Minimum sipariş: 30 Adet
apparel,Guangzhou giysi pazarı satın sonbahar kış ön-st...,$1,Guangzhou Feituos Internati...,Minimum sipariş: 1 Kilometre
apparel,Mix stilleri yüksek kalite yeni giysi giyim sür...,"$1,65",Jinan Dongtai Renewable Res...,Minimum sipariş: 100 Kilogram
apparel,Ucuz toplu kadın giyim elbise gömlek bluz üstle...,"$0,74-1,75",Shenzhen Weibili Technology...,Minimum sipariş: 2 Adet
apparel,Çin orijinal fabrika giyim stok karışık kore ta...,"$0,99",Quzhou Xingke Technology Co...,Minimum sipariş: 1.000 Kilogram
apparel,Toptan elbise giyim stok kadınlar karışık düşük...,"$0,90-0,99",Fuzhou Zhi Min Fang Yuan Im...,Minimum sipariş: 2 Adet
apparel,Giyim stok erkek yüksek kaliteli aşırı stokları...,"$1,78-2,15",Guangzhou Wetops Electronic...,Minimum sipariş: 2 Adet
apparel,En iyi kalite ikinci el giysi mix ikinci el mar...,"$1,40-1,70",Dongguan Cimine Environment...,Minimum sipariş: 1.000 Kilogram
apparel,Bangladeş konfeksiyon Stocklot giyim/gönderi İp...,"$2,90-4,20",SIXSEASON GLOBAL BUSINESS LTD.,Minimum sipariş: 200 Adet
apparel,Üreticiden doğrudan ikinci el kıyafet toptan alın,$120-200,MEMA,Minimum sipariş: 10 Ton
apparel,Presummer yaz giyim koleksiyonu,$17.500-40.000,"JUYOUE TRADING CO., LTD.",Minimum sipariş: 1 Yirmi Fut Konteyner
apparel,Çok tip günlük giyim parti giysileri yüksek per...,$1,TOPWELL CREATIVE CORP.,Minimum sipariş: 2 Adet
apparel,Özel yeni stil ucuz giyim stok temizleme yüksek...,"$3,15",Xiamen Wellgold Industry Co...,Minimum sipariş: 100 Adet
apparel,Sıcak satış yaz özel Logo giyim bebek giyim pam...,"$5,42",Xinxiang Jiangnan Departmen...,Minimum sipariş: 2 Adet
apparel,Giyim stok fabrika satış markalı t shirt erkek ...,"$0,98-1,58",Shandong Guangying Renewabl...,Minimum sipariş: 200 Kilogram
apparel,Vintage tarzı ikinci el Apparels aksesuarları l...,"$1,20-2,20",NAVARRO ENTERPRISES PTY LTD,Minimum sipariş: 20.000 Kilogram
apparel,Hazır giysiler stok Lot Tshirt toplu bangladeş ...,"$0,93-0,96",1 & 9 APPAREL CREATOR LTD.,Minimum sipariş: 5.000 Adet
apparel,Toptan Steve & James moda tasarımları erkek göm...,$12-18,"Steve & James Co.,Ltd",Minimum sipariş: 1 Adet
apparel,Fabrika demetleri ikinci el üniformaları overru...,"$4,50-4,60",Shenzhen Sumzao Industrial ...,Minimum sipariş: 100 Kilogram
apparel,Markalı ürünler bangladeş konfeksiyon stok Lot/...,"$1,50-3",DUDS,Minimum sipariş: 500 Adet
